codeType,code,name,contents,name_en,contents_en
KCS,414100,방습공사,"1. 일반사항1.1 적용범위(1) 이 기준은 지면에 접하는 콘크리트, 블록벽돌 및 이와 유사한 자재로 축조된 벽체 또는 바닥판의 습기 상승을 방지하는 공사나 비 및 이슬에 노출되는 벽면의 흡수 등을 방지하기 위하여 박판 시트계, 아스팔트계, 시멘트 모르타르계 또는 신축성 시트계의 수밀 차단재를 사용하는 방습공사에 적용한다.(2) 발주자는 공사를 발주할 때 이 기준의 규정을 기준으로 당해 공사에 적합한 기준을 작성하여 적용하도록 하여야 한다.(3) 발주자는 관련 기준을 작성할 때 이 기준에 규정하지 않은 사항과 이기준의 규정만으로 실제의 시공조건을 충족시키지 못할 경우에는 다른 기준의 규정을 따르거나 특별한 기준을 적용할 수 있다.1.2 참고 기준1.2.1 관련 법규 내용 없음1.2.2 관련 기준KCS 41 40 01 방수공사 일반KCS 41 40 02 아스팔트 방수공사KCS 41 40 08 시멘트모르타르계 방수공사KCS 41 40 15 발수공사1.3 용어의 정의 ● 박판: 얇은 널빤지나 철판 등● 방습: 습기가 눅눅하게 스며드는 것을 막음● 적층: 층층이 쌓는 것   기타 관련 용어는 KCS 41 40 01 (1.3) 에 따른다. 1.4 제출물     KCS 41 40 01 (1.4) 에 따른다. 1.5 품질보증     KCS 41 40 01 (1.5)에 따른다.1.6 환경유의사항     KCS 41 40 01 (1.6) 에 따른다. 2. 자재2.1 박판시트계 방습자재(1) 종이 적층 방습자재아스팔트 또는 내습성 복합물로 적층된 무거운 크라프트지로, 주위가 유리섬유 또는 내구력이 있는 파이버로 보강되어 있는 것(2) 적층된 플라스틱 또는 종이 방습자재탄화폴리에틸렌지와 크라프트지로 적층되고, 글라스 파이버로 보강된 것(3) 펠트, 아스팔트 필름 방습층아스팔트를 침투시킨 펠트의 적층판이나 파이버로 보강된 방수 아스팔트 또는 두께 0.1mm 이상의 PVC 필름으로 보강된 방수 아스팔트(4) 플라스틱 금속박 방습자재폴리에스테르 플라스틱 두 장 사이에 적층된 알루미늄박(5) 금속박과 종이로 된 방습자재글라스 파이버로 보강되고, 유연하게 코팅된 크라프트지에 적층된 반사성 알루미늄박(6) 금속박과 비닐직물로 된 방습자재글라스 파이버로 보강된 연회색의 비닐 시트에 반사성의 알루미늄박을 적층한 것(7) 금속과 크라프트지로 된 방습자재전해질의 동 또는 납으로 코팅된 동을 아스팔트로 골판지에 부착한 것(8) 보강된 플라스틱 필름 형태의 방습자재폴리에틸렌 필름 사이에 나일론, 유리섬유 혹은 폴리프로필렌 직물을 적층한 것2.2 아스팔트계 방습자재KCS 41 40 02에서 정하는 품질 이상의 것으로 한다.2.3 시멘트 모르타르계 방습자재KCS 41 40 08(2.1), KCS 41 40 08(2.3)에서 정하는 품질 이상의 것으로 한다.2.4 신축성 시트계 방습자재(1) 비닐 필름 방습지 : 가소성 폴리비닐 염화물의 필름(2) 폴리에틸렌 방습층 : 두께가 0.10mm 이상의 단열 폴리에틸렌 필름(3) 교착성이 있는 플라스틱 아스팔트 방습층 : 교착성 고무질 아스팔트 코팅을 한 0.10mm 두께 1겹의 탄화 폴리에틸렌 필름(4) 방습층 테이프 : 한 면이 압력에 민감한 교착제가 있는 폴리에스테르 필름 두 장 사이에 적층된 알루미늄박2.5 기타 자재기타 자재는 방습재 제조자의 지정에 따른다.2.6 품질기준방습자재의 품질기준은 표 2.6-1에 적합한 것이어야 한다.표 2.6-1 품질 기준		항목			A종			B종			투습성(투습저항) ㎡.s.Pa/ng	{㎡.h.mmhg/g｝			82×10-3｛170｝이상			144×10-3｛300｝이상			강도(철침 유지강도) N			23 ℃			15 이상			－5 ℃			15 이상			내구성			가열처리 후의 세로방향 인장절단 신장잔율(%)			50 이상			알칼리 처리 후의 세로방향 인장절단 신장잔율(%)			80 이상			발화성			발화하지 않을 것	3. 시공3.1 일반사항콘크리트, 블록, 벽돌 등의 벽체가 지면에 접하는 곳은 지상 100∼200mm 내외 위에 수평으로 방습층을 설치한다. 그 자재, 공법의 지정은 설계도서에 따르고, 공사시방에 정한 바가 없을 때는 방수 모르타르바름(두께 10∼20mm)으로 한다. 3.1.1 각종 방습층 공법(1) 아스팔트 펠트, 아스팔트 루핑 등의 방습층아스팔트 펠트, 아스팔트 루핑 등으로 할 때는 밑바탕 면을 수평지게 평탄히 바르고 아스팔트로 교착하여 댄다. 아스팔트 펠트, 아스팔트 루핑 등의 너비는 벽체 등의 두께보다 15mm 내외로 좁게 하고, 직선으로 잘라 쓴다. 이음은 100mm 이상 겹쳐 아스팔트로 교착한다.(2) 비닐지의 방습층비닐지는 지정하는 품질과 두께가 있는 자재를 전항에 준하여 시공한다.  교착제는 동종의 비닐수지계 교착제 또는 아스팔트를 사용한다.(3) 금속판의 방습층금속판을 쓸 때는 지정하는 재질로서 품질, 두께를 설계도서에 따르고, 이음은 거멀접기 납땜하거나 겹치고 수밀도장 또는 수밀 교착법으로 한다.(4) 방수모르타르의 방습층방수모르타르로 할 때는 바탕면을 충분히 물씻기 청소를 하고, 시멘트 액체 방수 공법에 준하여 시공한다.(5) 기타의 방습층기타의 공법은 전항에 준한다.3.1.2 바닥 밑 방습층콘크리트 다짐바닥, 벽돌깔기 등의 바닥면에 방습층을 둘 때에는 잡석다짐 또는 모래다짐 위에 아스팔트 펠트나 비닐지를 깔고 그 위에 콘크리트 또는 벽돌깔기를 한다. 잡석다짐, 모래다짐의 윗면은 아스팔트 펠트, 비닐지가 우그러들거나 찢어지지 않게 수평면으로 평활하게 다져 고른다. 아스팔트 펠트, 비닐지의 이음은 100mm이상 겹치며, 겹침부위는 제조업자의 방습테이프 등으로 마감한다.3.1.3 방수 모르타르 바름중요하지 않은 벽면, 바닥면의 방습, 방수를 위해 방수재 혼합모르타르로 바를 때의 자재배합비는 시멘트 액체 방수공법에 준한다. 바탕이 지나치게 거칠 때는 1회 모르타르 밑바름을 하고, 방수모르타르를 바른다. 바탕이 지나치게 미끄러울 때는 표면을 정, 주걱, 기타 공구로 긁거나 찍어서 거칠게 하여 부착이 잘되게 한다. 방수모르타르의 바름 두께 및 회수는 정한 바가 없을 때 두께 15mm 내외의 1회 바름으로 한다.3.2 검사 및 준비(1) 자재는 방습층 공사가 실시되는 바탕면과 조건을 면밀히 검토하여야 한다.(2) 불만족스러운 조건들이 수정되기 전에는 작업을 진행시키지 않아야 한다.(3) 바탕면 구조나 개구부의 틀이 완성된 후에 방습층 공사를 하여야 한다.(4) 방습층을 통해 환기구, 배수구 기타의 돌출구를 설치한다.(5) 방습층이 놓이는 바탕을 깨끗이 하고 예리한 돌출물은 없앤다.3.3 방습공사 시공법3.3.1 박판 시트계 방습공사(1) 지정된 방습재를 방습재 제조자 지정의 접착제로 바탕에 접착되도록 시공한다. 또한 완전하고 효과적으로 방습층이 바닥에 접착하여 바닥판의 리브로 복합물이 스며들지 않게 한다.(2) 벽이나 바닥, 천장, 지붕, 바닥판 그 밖의 곳에 방습층이 표시되어 있으면 지시된 방법과 자재로 설치한다. 구멍 뚫림이 없게 세심한 주의를 하여야 하며, 필요한 곳에는 접착제를 사용하고 접착제를 사용할 수 없는 곳에는 못이나 스테이플로 정착한다.3.3.2 아스팔트계 방습공사(1) 바탕면의 준비① 돌출부 및 공사진행에 방해되는 이물질을 깨끗이 청소하여야 한다.② 경사끼움 스트립(켄트 스트립) 및 유사한 부속재를 설치한다.③ 빈 공간을 잘 메우고 이음 부분은 충전하며 본드 브레이커를 사용하는 곳에는 특히 이어붓기 부분에 주의하여야 한다.④ 액체나 유상액이 배수구나 낙수홈통을 막지 않도록 하고, 다른 공사의 표면으로 쏟아지거나 흘러내리는 것을 막기 위한 덮개를 하여야 한다.(2) 아스팔트 방습 시공① 아스팔트 경사끼움 스트립수직 방습공사의 밑부분이 수평과 만나는 곳에는 밑변 50mm, 높이 50mm 크기의 경사끼움 스트립을 설치한다.② 수직 방습공사는 벽을 따라 지표면부터 기초의 윗부분까지 연장하고, 기초 윗부  분에는 최소한 150mm 정도 기초의 외면까지 돌려 덮는다. 벽이 서로 만나는 부분이나 기초에서는 300mm 정도 방습면을 연장하여야 하지만 공사가 완공되었을 때 외부로 나타나는 부분까지 연장해서는 안 된다.③ 외벽 표면의 가열 아스팔트 방습가. 보통 지표면 아래 구조벽에 사용된다.나 바탕면에 거품이 생길 경우에는 가열 아스팔트를 사용하지 않는다.다. 균일한 두께의 아스팔트를 형성하기 위한 가열 아스팔트의 코팅량은 방습재 제조자의 지정에 따른다.④ 외부 및 내부 표면의 냉각 아스팔트 방습가. 균질한 건식 필름을 만들기 위한 냉각 아스팔트의 사용량은 방습재 제조자의 지정에 따른다.나. 외부 표면에는 피치나 아스팔트 방습제 중의 어느 하나를 사용토록 한다. 실내 표면에는 아스팔트만을 사용토록 한다.다. 방습도포는 첫 번째 도포층을 24시간 동안 양생한 후에 반복하여야 한다. 두 번째 도포는 첫 번째 도포가 부드럽고 수밀하면서도 광택성이 있는 도포층이 되지 않았을 경우에는 다시 두 번 도포를 하여야 하며, 그 두께는 두 배로 해야 한다.⑤ 외부 및 내부 표면의 유제 아스팔트 방습액체 아스팔트 유상액의 방습자재로 균일한 건성 필름으로 하기 위한 공사는 공사시방에 의한다.3.3.3 시멘트 모르타르계 방습공사벽면, 바닥면의 방습을 위하여 시멘트 모르타르로 바를 때의 공사는 KCS 41 40 08에 준한다.3.3.4 신축성 시트계 방습공사비닐필름 방습층은 접착제로 사용하여 완전하게 금속 바닥판에 밀착되도록 시공한다. 또한 완전하고 효과적으로 방습층이 바닥판에 리브로 복합물이 스며들지 않게 한다. 필요한 곳에는 접착제를 사용하고 접착제를 사용할 수 없는 곳에는 못이나 스테이플로 정착한다.3.4 방습층의 보호바닥판이나 하부 바닥에 설치된 방습층 상부가 보행 등의 통로가 되어서는 안 되며, 방습층에 구멍이 생기거나 기타의 하자가 생기지 않도록 한다. 또한 방습층 설치자는 방습층에 구멍이 생기거나 기타의 하자가 생기지 않게 하며, 필요시에는 보호책을 마련한다.",Moisture-proofing work,"1. General Provisions 1.1 Scope of Application (1) This standard applies to moisture-rising prevention work for walls or floor slabs constructed of concrete, block masonry, and similar materials that come into contact with the ground, and to moisture absorption prevention work for exterior walls exposed to rain and dew, using waterproofing materials such as thin sheet systems, asphalt systems, cement mortar systems, or flexible sheet systems. (2) When procuring work, the client shall establish and apply standards suitable for the work based on the provisions of this standard. (3) When establishing related standards, the client may follow the provisions of other standards or apply special standards if the provisions of this standard do not address certain matters or cannot satisfy actual construction conditions. 1.2 Reference Standards 1. No relevant regulations for 2.1. 1. 2.2 Related Standards KCS 41 40 01 General Waterproofing Works KCS 41 40 02 Asphalt Waterproofing Works KCS 41 40 08 Cement Mortar Waterproofing Works KCS 41 40 15 Hydrophobic Treatment Works 1.3 Definitions ● Thin plate: Thin boards or metal sheets, etc. ● Moisture barrier: Preventing moisture from seeping in damply ● Layering: Stacking layer by layer. Other related terms are in KCS 41 40 01 ("" follows 1.3) 1.4 Submission KCS 41 40 01 ( complies with 1.4) 1.5 Quality Assurance KCS 41 40 01 ( complies with 1.5) 1.6 Environmental Considerations KCS 41 40 01 ( 1.6) Complies with. 2. Materials 2.1 Sheet-type moisture barrier materials (1) Paper laminated moisture barrier material: Heavy kraft paper laminated with asphalt or a moisture-resistant compound, with the periphery reinforced with fiberglass or durable fiber. (2) Laminated plastic or paper moisture barrier material: Laminated with polyethylene and kraft paper, and reinforced with glass fiber. (3) Felt, asphalt film moisture barrier layer: A laminated sheet of felt impregnated with asphalt or a waterproof asphalt reinforced with fiber or thickness. Moisture barrier materials including (4) waterproof asphalt reinforced with PVC film of 0.1mm or more, (5) aluminum foil laminated between two layers of polyester plastic, (6) reflective aluminum foil laminated on flexible coated kraft paper reinforced with fiberglass, (7) reflective aluminum foil laminated on gray vinyl sheet reinforced with fiberglass and vinyl fabric, (8) copper or lead-coated copper of electrolyte attached to cardboard with asphalt, and (9) moisture barrier in the form of reinforced plastic film with nylon, fiberglass, or polypropylene fabric laminated between polyethylene film. The asphalt waterproofing material shall be of quality equal to or higher than that specified in KCS 41 40 02. 2.3 Cement-based mortar waterproofing materials KCS 41 40 08( 2.1), KCS 41 40 08( shall be of quality equal to or higher than that specified in 2.3). 2.4 Flexible Sheet-Type Moisture Barrier (1) Vinyl Film Moisture Barrier: Film of Plasticized Polyvinyl Chloride (2) Polyethylene Moisture Barrier Layer: Thickness of Moisture barrier layer with adhesive plastic asphalt: coated with adhesive rubber asphalt. Moisture barrier tape with a single layer of 0.10mm thick chemically modified polyethylene film (4): Aluminum foil laminated between two layers of polyester film, one side of which has pressure-sensitive adhesive. ""2.5 Other materials Other materials shall be in accordance with the dehumidifier manufacturer's specifications."" ""2.6 Quality Standards for Moisture-Proof Materials are shown in the table"" It should be suitable for Table 2.6-1. 2.6-1 Quality Standards		Item			Type A			Type B			Water Vapor Permeability (Resistance) ㎡.s.Pa/ng	{㎡.h.mmhg/g｝			82×10-3｛170｝or more			144×10-3｛300｝or more			Strength (Nail-Holding Strength) N			23 ℃			15 or more			－5 ℃			15 or more			Durability			Elongation at Break after Heat Treatment (%)			50 or more			Elongation at Break after Alkali Treatment (%)			80 or more			Flammability			Shall not ignite	3. Construction Where walls made of concrete, blocks, or bricks come into contact with the ground, a horizontal moisture barrier shall be installed within 100-200mm above ground level. The materials and methods shall be specified in the design documents, and if not specified in the construction specifications, a waterproofing mortar coating (10-20mm thick) shall be applied. 3. 1.1 Various Moisture Barrier Methods (1) Asphalt Felt, Asphalt Roofing, etc. When applying asphalt felt or asphalt roofing, prepare the base surface horizontally and smoothly, and adhere it with asphalt. The width of the asphalt felt, asphalt roofing, etc., should be approximately 15mm narrower than the thickness of the wall, and cut straight. Joints should overlap by 100mm or more and be adhered with asphalt. (2) Vinyl Sheet Moisture Barrier The vinyl sheet shall be installed in accordance with the previous clause, using materials of specified quality and thickness. The adhesive shall be a vinyl resin-based adhesive or asphalt of the same type. (3) Metal Sheet Moisture Barrier When using metal sheets, the material, quality, and thickness shall comply with the design specifications. Joints shall be soldered with a crimped joint, overlapped, or sealed with a waterproof coating or waterproof adhesive. (4) Waterproof Mortar Moisture Barrier When using waterproof mortar, thoroughly clean the base surface with water and install it in accordance with the cement-based liquid waterproofing method. (5) Other Moisture Barrier Methods Other methods shall comply with the previous clause. 3. When installing a moisture barrier layer on the ground surface, such as on compacted gravel or sand, concrete or brickwork, asphalt felt or vinyl sheet should be laid over the compacted gravel or sand. The top surface of the compacted gravel or sand should be leveled and compacted horizontally to prevent the asphalt felt or vinyl sheet from buckling or tearing. The seams of the asphalt felt or vinyl sheet should overlap by at least 100mm, and the overlapping areas should be sealed with the manufacturer’s moisture tape or similar materials. 3. 1.3 Waterproof Mortar Application. For damp-proofing and waterproofing of unimportant walls and floors, use a mortar mixed with waterproofing agents. The material mixing ratio when applying this mortar shall be equivalent to that of cement-based liquid waterproofing methods. If the substrate is excessively rough, apply one coat of mortar base and then the waterproof mortar. If the substrate is excessively smooth, roughen the surface using a trowel, scraper, or other tools to ensure proper adhesion. When the specified thickness and number of coats for the waterproof mortar are not determined, apply a single coat with a thickness of approximately 15mm. 3.2 Inspection and Preparation (1) Materials shall thoroughly examine the substrate and conditions where the moisture barrier work is to be performed. (2) Work shall not proceed until unsatisfactory conditions are rectified. (3) The moisture barrier work shall be carried out after the structure of the substrate and the framework of openings are completed. (4) Install ventilation openings, drainage outlets, and other protrusions through the moisture barrier. (5) Clean the substrate where the moisture barrier will be laid and remove any sharp protrusions. 3.3 Moisture-proofing Construction Method 3. 3.1 Moisture-Proofing Work with Sheet Materials (1) Install the designated moisture barrier using the adhesive specified by the moisture barrier manufacturer, adhering it to the substrate. Ensure the moisture barrier is completely and effectively bonded to the floor to prevent composite materials from the floor panels from penetrating. (2) If the moisture barrier is indicated on walls, floors, ceilings, roofs, floor panels, or other locations, install it using the specified methods and materials. Exercise careful attention to prevent punctures, and use adhesive where applicable, and fasteners such as nails or staples where adhesive cannot be used. 3. 3.2 Asphalt-Based Waterproofing Works (1) Surface Preparation
① Remove all protrusions and foreign matter that obstruct construction progress.
② Install slope strips (kent strips) and similar accessories.
③ Fill voids thoroughly, backfill joints, and pay particular attention to abutting areas when using bond breakers.
④ Prevent liquids or emulsions from clogging drains or downspouts, and cover surfaces to prevent spills or runoff onto other work areas.

(2) Asphalt Waterproofing Application
① Install slope strips with a base of 50mm and a height of 50mm where the bottom of the asphalt slope strip vertical waterproofing work meets the horizontal surface.
② The vertical waterproofing work shall extend along the wall from the ground surface to the top of the foundation, and shall overlap the exterior face of the foundation by at least 150mm.  The waterproofing membrane shall be extended approximately 300mm where walls or foundations meet, but not beyond the point where it becomes visible upon completion of the work.
③ Hot asphalt waterproofing for exterior surfaces. Typically used on structural walls below ground level.
a. Do not use hot asphalt if bubbles appear on the surface.
b. The coating amount of hot asphalt to form a uniform thickness shall be in accordance with the manufacturer's specifications for the waterproofing material.
④ Cold asphalt waterproofing for exterior and interior surfaces. The amount of cold asphalt to use to create a uniform dry film shall be in accordance with the manufacturer’s specifications for the waterproofing material.
a. For exterior surfaces, use either pitch or asphalt waterproofing agent. For interior surfaces, use only asphalt.
b. Waterproofing application shall be repeated after curing the first coat for 24 hours. If the first coat is not smooth, watertight, and glossy, apply a second coat, and if necessary, a third coat, doubling the thickness.
⑤ For exterior and interior surfaces, waterproofing with emulsion asphalt – liquid asphalt emulsion – shall be performed according to the construction specifications to create a uniform dry film. 3. ""3.3 Cement mortar-based damp-proofing works for walls and floors shall conform to KCS 41 40 08 when applying cement mortar for damp-proofing."" 3. The moisture barrier film of flexible sheet type for damp-proof construction shall be installed using an adhesive to ensure complete adhesion to the metal floor panel. Furthermore, the moisture barrier layer shall effectively prevent the composite material of the floor panel from penetrating. Adhesive shall be used where necessary, and nails or staples shall be used for fastening in areas where adhesive cannot be applied. The upper surface of the moisture barrier installed on the protective floor slab or lower floor slab shall not be used as a walkway or passage, and the moisture barrier shall not be damaged by holes or other defects. Also, the moisture barrier installer shall prevent holes or other defects in the moisture barrier and take protective measures when necessary."
