codeType,code,name,contents,name_en,contents_en
KCS,214505,가설교량,"1. 일반사항1.1 적용 범위(1) 이 기준은 지하철, 교량 및 터널 등의 토목공사에 수반되는 가설교량의 시공에 대하여 적용한다.1.2 참고 기준1.2.1 관련 법규내용 없음1.2.2 관련 기준. KCS 21 10 00 가설공사 일반사항. KCS 21 30 00 가설흙막이 공사. KCS 24 00 00 교량공사. KDS 21 45 00 가설교량 및 노면 복공 설계기준. KS B 1002 6각 볼트. KS B 1012 6각 너트 및 6각 낮은 너트. KS B 2819 구조물용 토크-전단형 고장력 볼트, 6각 너트 및 평와셔의 세트. KS D 3503 일반 구조용 압연 강재. KS D 3515 용접 구조용 압연 강재. KS D 7004 연강용 피복 아크 용접봉. KS D 7006 고장력 강용 피복 아크 용접봉. KS F 4602 강관 말뚝. KS F 4603 H형강 말뚝. KS F 4605 강관 시트파일1.3 용어의 정의. 가설교량: 공사용 기자재와 재료 운반 및 통행을 위해서 임시로 가설된 교량 또는 우회도로용(철도포함) 임시 교량1.4 제출물(1) 제출물의 범위는 공사의 범위와 종류에 따라 공사시방서에 따르며, 제출물에 포함되는 내용은 KCS 21 30 00에 따른다.2. 자재(1) 가설교량에 사용하는 재료는 KDS 21 45 00에 적합한 구조용 재료를 사용하는 것을 원칙으로 한다.(2) 구조용 형강은 KS F 4602, KS F 4603 및 KS F 4605, ㄱ형강 또는 ㄷ형강은 KS D 3503의 SS275 또는 KS D 3515의 SM275에 적합하여야 한다.(3) 볼트 및 너트는 KS B 1002, KS B 1012 및 KS B 2819의 A등급에 적합한 강제 볼트 및 너트이어야 한다.(4) 용접봉은 KS D 7004, KS D 7006에 적합한 것으로 E4301, E5001 일루미나이트계, E 4316, E5016, E5316, E5816, E6216, E7016, E7616, E8016 저수소계를 사용하여야 한다.(5) 강관 말뚝은 KS F 4602에 적합한 형강, H형강 말뚝은 KS F 4603에 적합한 형강, 강관시트파일은 KS F 4605에 적합한 형강으로 승인된 시공상세도에 명시된 대로 가설교량을 설치하는데 필요한 치수를 가진 제품이어야 한다.(6) 재사용품을 가설교량에 사용하기 위해서는 KCS 21 10 00(1.6.2) 의 기준을 만족하여야 하며, 자재관리에 관한 일반적인 사항은 KCS 21 10 00에 따른다.(7) 한국산업표준(KS) 제품이 아닌 일반제품을 사용할 때는 반입자재에 대하여 사용 전에 품질시험 성적서를 공사감독자에게 제출하여야 한다.(8) 이 기준에서 규정한 재료 이외의 재료는 공인시험기관의 성능시험 등에 의하여 사용목적에 적합한 제품을 공사감독자의 승인을 받아 사용할 수 있다.3. 시공3.1 일반사항(1) 수급인은 현장의 지형, 지반조사 및 수위 등의 현장조건을 면밀히 파악한 후 시공계획을 수립하여야 한다.(2) 가설교량의 높이는 최대 홍수위 및 수면교통을 감안하여 계획하여야 하며, 수급인은 시공 전 해당 관리청에 가설교량의 설치기간, 설치범위에 대하여 공사감독자에게 승인을 받아야 한다.(3) 교통표지판, 경광등 등의 유도표지를 설치하여 안전사고를 방지하여야 한다.(4) 대규모 구조물 공사로 장기간에 걸쳐 시공되는 경우에는 가설물막이를 현장여건에 따라 설치하고 육상 작업장으로부터 가설물막이와 병행하여 가설교량을 설치한다.(5) 가설교량의 설치위치는 홍수 시의 유수에 대하여 관리상 본 공사 하류로 하며, 가설물막이 하류에 근접한 지점으로 한다.(6) 둔치로부터의 연결부분은 홍수 시에 유수흐름에 장애가 되지 않아야 하며, 제방의 안정성에 위해한 영향을 주지 않아야 한다.(7) 가설교량은 가설물막이의 설치속도에 맞추어 차례로 연장하고, 가설물막이에 연결되는 분기선은 가설물막이 철거와 동시에 철거한다.(8) 분기부는 차량의 안전운행을 위하여 충분한 넓이를 확보해야 한다.(9) 볼트 조임 후 이탈되지 않도록 안전장치 및 볼트에 대한 안전관리 일지를 정기적으로 작성하여야 한다.3.2 가설교량(1) 가설교량의 설계하중은 KL-510, 대형공사용 기계의 상재하중, 공사용 기계의 수평하중 및 기타 유수, 토압, 파도, 바람에 의한 수평력 및 온도하중을 기준으로 시공하여야 한다.(2) 가설교량의 폭은 교통소통과 안전운행에 지장이 없도록 계획하여야 한다.(3) 가설교량은 공용기간 중 파손이 없는 포장단면이나 복공판을 설치하여야 하며, 필요시 양질의 충격완화용 성토재료로 시공할 경우에는 재료가 유실되지 않도록 부직포를 설치할 수 있다.(4) 가설교량의 좌․우측에는 난간을 설치하여야 하며 난간의 높이는 노면으로부터 0.9m 이상, 1.2m 이하이어야 하며, 좌.우측 난간은 추락방지를 위해 와이어 로프 등으로 결속하여야 한다.(5) 가설교량의 좌.우측 방호울타리에는 야간에 반사체를 4m 간격으로 포장면으로부터 0.9m 높이에 설치하여 차량시선을 유도하여야 한다.(6) 가설교량의 하부기초는 소요 지내력이 확보되도록 시공하여 차량통행 시 계측시스템 등을 통해 하부기초가 설계에서 고려된 허용침하량 이내로 관리되도록 조치하여야 한다.(7) 공사용 가설교량 설치 시 다음 사항에 따른다.① 포장 노면의 계획고는 평수위(MWL)를 감안하여 1m 이상 여유고를 확보하여야 한다.② 하천상의 가교 설치 시 유수의 흐름에 방해가 되지 않도록 가교의 설치에 대한 관할 하천관리기관의 의견을 들어야 한다. ③ 평수위(MWL)에 대한 자료가 없거나 관측이 곤란한 경우 가설교량 설치기간을 고려한 설계빈도로 홍수위를 산정한 후 공사감독자에게 제출하여 승인을 받은 후 시공하여야 한다.(8) 우회용 가설 교량 설치 시 다음 사항에 따른다.① 기존교량의 계획고 또는 제방의 계획고를 기준으로 하되 기존 교량의 여유고 부족으로 교체되는 경우 가설교량 거더 하단이 기존 교량 슬래브 하단보다 높게 설치되어야 한다.② 최소 지간장 적용 시 기존 교량의 설치 지간장을 기준으로 계획하고 부득이 확장이 필요한 경우 공사감독자의 승인을 받은 후 시공하여야 한다.(9) 횡단도로상의 가설교량은 차량통행에 지장이 없도록 설계기준 등에서 정한 형하여유고를 확보하고 소요 차로수 및 차로폭이 유지되도록 시공하여야 한다.(10) 가설교량의 교대부분에는 기존도로 및 접속도로의 토공부에 손상이 없도록 흙막이 벽 등 보호시설을 설치하여야 한다.(11) 해상에 가설교량을 설치할 경우에는 가교통과 유속을 측정하여 현장여건에 맞는 계획을 수립하여 공사감독자의 승인을 받은 후 시공하여야 한다.(12) 가설교량은 공사완료 후 공사감독자의 승인을 받은 후 철거 및 원상복구 하여야 한다.(13) 가설교량 접속부 포장 단차는 원활한 차량소통에 문제가 없도록 연결부를 시공하여야 한다.(14) 기존 교량에 보도가 있거나 시민의 통행이 빈번할 때 가설교량 외측은 통행이 가능한 인도와 안전난간대를 설치하여야 한다.3.3 지지말뚝(1) 지지말뚝 설치 시 가이드 빔(beam)을 설치하여 강재의 연직도를 검사하여 시공하여야 한다.(2) 말뚝 전면에 일정간격으로 심도를 표시하여 근입 정도를 지표면에서 확인할 수 있도록 하여 근입 깊이까지 말뚝을 설치하여야 한다.(3) 지지층 지반이 풍화암 이상의 암층으로 구성되어 직접 항타 시공 시 인접 건물이나 지장물의 피해가 예상되어 민원 등의 우려가 있을 경우 직접 항타를 피하고 천공을 하여야 한다.(4) 천공 지지말뚝의 관입이 용이하도록 천공하여야 하며, 말뚝 선단 근입 시 지지 지반이 풍화암 이하일 경우 1.0m 이상, 연암 이상 시 0.5m 이상 근입되도록 하여야한다.(5) 천공 후 지지말뚝은 연직을 유지하여야 하며 작업 중 확인을 철저히 하여야 한다.(6) 천공면 상단부의 붕괴가 우려될 경우에는 케이싱 등을 설치하여 천공면을 보호하여야 한다.(7) 지지말뚝을 이음 연결하여 사용할 때는 인접 말뚝의 이음 위치가 동일 높이에서 시공되지 않도록 하여야 한다.(8) 말뚝선단이 지지층에 도달하여 설계지지력을 얻었다는 근거와 소요 근입장에 도달하면 말뚝 관입을 중지하여야 한다. 하지만 현장 지반의 여건에 따라 파일의 근입장이 설계도서와 다른 경우 파일 지지력 추정방법을 통해 파일 항타를 중지 할 수 있다. (9) 말뚝을 설계지지력이 얻어지는 깊이까지 관입을 한 후에 수준측량기를 사용하여 설계도서 상의 계획고까지 측량을 실시한다. 측량 후 말뚝의 두부 상단의 위치에 마킹을 한 후 두부정리 작업을 실시하여야 한다. (10) 천공 및 항타장비는 말뚝의 종류, 중량, 근입 깊이, 타입본수, 토질, 주위환경 등을 고려하여 안전하고 경제적인 장비를 선택하여야 한다.(11) 말뚝선단이 지지층에 도달하여도 설계지지력을 확보하였는지 말뚝재하시험을 실시하여 확인하여야 한다.",Provisional bridge,"1. General Provisions 1.1 Scope of Application (1) This standard applies to the construction of temporary bridges involved in civil engineering works such as subways, bridges, and tunnels. 1.2 Reference Standards 1. No relevant regulations regarding 2.1. 1. 2.2 Related Standards. KCS 21 10 00 General Temporary Construction Works. KCS 21 30 00 Temporary Earth Retaining Works. KCS 24 00 00 Bridge Construction. KDS 21 45 00 Provisional Bridge and Pavement Deck Design Standard. KS B 1002 Hexagon Bolt. KS B 1012 Hexagon Nut and Low Hexagon Nut. KS B 2819 Torque-Shear Type High Strength Bolt for Structures, Hexagon Nut and Plain Washer Set. KS D 3503 Rolled Steel for General Structural Purposes. KS D 3515 Rolled Steel for Welding Structures. KS D 7004 Flux Arc Welding Rod for Mild Steel. KS D 7006 Flux Arc Welding Rod for High Strength Steel. KS F 4602 Steel Pipe Pile. KS F 4603 H-Shape Steel Pile. KS F 4605 Steel Sheet Pile. 1.3 Definitions. Temporary Bridge: A temporary bridge or detour road (including railways) constructed for the transportation of construction materials and equipment and for passage. 1.4 Submissions (1) The scope of submissions shall be in accordance with the project specifications depending on the scope and type of the work, and the contents included in the submissions shall comply with KCS 21 30 00. 2. Materials (1) The materials used for the temporary bridge shall be based on the principle of using structural materials suitable for KDS 21 45 00. (2) Structural shapes shall comply with KS F 4602, KS F 4603, and KS F 4605, and angle or channel shapes shall comply with SS275 of KS D 3503 or SM275 of KS D 3515. (3) Bolts and nuts shall be high-strength bolts and nuts suitable for Grade A according to KS B 1002, KS B 1012, and KS B 2819. (4) Welding electrodes shall be suitable for KS D 7004 and KS D 7006, and shall use E4301, E5001 illuminite series, E 4316, E5016, E5316, E5816, E6216, E7016, E7616, and E8016 low-hydrogen series. (5) Steel pipe piles shall be steel shapes suitable for KS F 4602, H-shaped steel piles shall be steel shapes suitable for KS F 4603, and steel sheet piles shall be steel shapes suitable for KS F 4605, and shall be products with dimensions required to install the temporary bridge as specified in the approved shop drawings. (6) In order to use reused materials for the temporary bridge, KCS 21 10 00. 1. 6.2) requirements shall be met, and general matters regarding material management shall be in accordance with KCS 21 10 00.(7) When using general products that are not Korean Industrial Standards (KS) products, a quality test certificate for incoming materials shall be submitted to the site supervisor before use.(8) Materials other than those specified in this standard may be used with the approval of the site supervisor, provided that they are products suitable for their intended purpose, verified by performance tests, etc., by a certified testing agency. 3. Construction 3.1 General Provisions
(1) The contractor shall thoroughly assess the site conditions, including topography, ground investigation, and water level, before establishing the construction plan.
(2) The height of the temporary bridge shall be planned considering the maximum flood level and waterborne traffic, and the contractor shall obtain approval from the relevant management authority regarding the installation period and scope of the temporary bridge through the construction supervisor prior to construction.
(3) Guidance signs, warning lights, etc. shall be installed to prevent safety accidents.
(4) In the case of large-scale structure construction projects that take a long time to complete, temporary cofferdams shall be installed according to the site conditions, and the temporary bridge shall be installed concurrently with the temporary cofferdam from the onshore work area.
(5) The location of the temporary bridge shall be downstream of the main project in terms of management, with respect to flood flow, and close to the downstream end of the temporary cofferdam.
(6) The connection portion from the embankment shall not impede the flow of water during floods and shall not adversely affect the stability of the levee.
(7) The temporary bridge shall be extended sequentially in accordance with the installation speed of the temporary cofferdam, and the branch lines connected to the temporary cofferdam shall be removed simultaneously with the removal of the temporary cofferdam.
(8) The branch section shall secure sufficient width for the safe passage of vehicles.
(9) Safety devices and a safety management log for the bolts shall be regularly prepared to prevent loosening after tightening. 3.2 Temporary Bridges (1) The design load of the temporary bridge shall be constructed based on KL-510, the superimposed load of large construction machinery, the horizontal load of construction machinery, and other hydrostatic pressure, earth pressure, waves, horizontal force due to wind, and temperature load. (2) The width of the temporary bridge shall be planned so as not to hinder traffic and safe operation. (3) The temporary bridge shall be installed with a paving section or a precast concrete slab that does not break down during the service period; if high-quality shock-absorbing embankment material is used for construction, geotextile shall be installed to prevent material loss. (4) Guardrails shall be installed on the left and right sides of the temporary bridge, and the height of the guardrail shall be from the pavement surface. 0.9m or higher It shall be 1.2m or lower, and the left and right handrails shall be secured with wire ropes, etc., to prevent falls. (5) Reflective materials shall be installed on the left and right protective fences of the temporary bridge at intervals of 4m from the pavement surface at night. 1. The temporary bridge shall be installed at a height of 0.9m to guide vehicle traffic. (6) The lower foundation of the temporary bridge shall be constructed to ensure the required bearing capacity, and during vehicle traffic, monitoring systems, etc., shall be used to manage the lower foundation within the allowable settlement considered in the design. (7) The following shall be observed when installing a temporary bridge for construction purposes. ① The planned elevation of the paved road surface shall secure a clearance of 1m or more, taking into account the mean water level (MWL). ② When installing a temporary bridge on a river, the opinion of the relevant river management authority shall be obtained to ensure that the installation does not obstruct the flow of water. ③ If data on the mean water level (MWL) is unavailable or observation is difficult, the flood level shall be calculated based on the design frequency considering the installation period of the temporary bridge, submitted to the construction supervisor for approval, and then construction shall be carried out. (8) The following shall be observed when installing a temporary detour bridge. ① The elevation shall be based on the planned elevation of the existing bridge or the embankment, but if the temporary bridge girder bottom is installed higher than the existing bridge slab bottom due to insufficient clearance of the existing bridge. ② When applying the minimum span, the plan shall be based on the installation span of the existing bridge, and if expansion is unavoidable, construction shall be carried out after obtaining the approval of the construction supervisor. (9) A temporary bridge on a crossroad shall be designed and constructed to ensure sufficient headroom as stipulated in the design criteria, etc., to prevent interference with vehicle traffic, and to maintain the required number of lanes and lane widths. (10) Protective facilities, such as retaining walls, shall be installed at the connection points of the temporary bridge to prevent damage to the earthwork of the existing road and access roads. (11) When installing a temporary bridge in the sea, the flow rate passing through the bridge shall be measured, a plan suitable for the site conditions shall be established, and construction shall be carried out after obtaining the approval of the construction supervisor. (12) After completion of the construction, the temporary bridge shall be dismantled and restored to its original condition after obtaining the approval of the construction supervisor. (13) The pavement level difference at the connection of the temporary bridge shall be constructed to ensure smooth vehicle traffic without problems. (14) If the existing bridge has a sidewalk or frequent pedestrian traffic, a pedestrian walkway and safety railings shall be installed on the outside of the temporary bridge to ensure safe passage. 3.3 Piles (1) During pile installation, install a guide beam to inspect and construct the verticality of the steel. (2) Mark the depth at regular intervals on the front of the pile to allow verification of the penetration depth from the ground surface, and install the pile to the specified penetration depth. (3) If the supporting ground is composed of rock layers above weathered rock and direct driving is expected to damage adjacent buildings or obstructions, potentially causing complaints, avoid direct driving and use drilling. (4) Drill to facilitate the penetration of bored piles, and if the supporting ground is below weathered rock when the pile tip penetrates, When height exceeds 1.0m, and when the geological condition is rocky. 1. The piles shall be embedded by more than 0.5m. (5) After drilling, the supporting piles shall maintain verticality and be thoroughly checked during work. (6) If there is a risk of collapse at the top of the drilled surface, casing or similar measures shall be installed to protect the drilled surface. (7) When connecting piles with splices, the splice locations of adjacent piles shall not be constructed at the same elevation. (8) When the pile tip reaches the bearing stratum and there is evidence that the design bearing capacity has been achieved, and the required embedment depth has been reached, pile penetration shall be stopped. However, if the pile embedment depth differs from the design specifications due to site ground conditions, pile driving may be stopped through a pile bearing capacity estimation method. (9) After the piles have penetrated to the depth at which the design bearing capacity is obtained, level measurements shall be taken using a leveling instrument to the planned elevation as specified in the design documents. After measurement, the location of the top of the pile head shall be marked, and then the pile head trimming work shall be performed. (10) Drilling and driving equipment shall be selected to be safe and economical, considering the type of pile, weight, embedment depth, number of templates, soil conditions, and surrounding environment. (11) Even if the pile tip reaches the bearing stratum, a pile load test shall be performed to confirm that the design bearing capacity has been secured."
