codeType,code,name,contents,name_en,contents_en
KCS,415104,벽공사,"1. 일반사항1.1 적용범위이 기준은 건물 내부 벽에 사용하는 재료 및 공법에 적용한다.1.2 참고 기준1.2.1 관련 법규       KCS 41 51 01 (1.2.1) 에 따른다.1.2.2 관련 기준● KS F 3104 (파티클보드)● KS F 3101 (보통 합판)● KS F 3103 (플로어링 보드)● KS F 3104 (파티클보드)● KS F 3200 (섬유판)● KS F 3129 (목재 벽판재)● KS F 4720 (목모보드)1.3 용어의 정의       KCS 41 51 01 (1.3)에 따른다.1.4 제출물       KCS 41 51 01 (1.4) 에 따른다.1.5 품질보증       KCS 41 51 01 (1.5)에 따른다.1.6 환경유의사항(1) 포름알데히드 방산량 등급에 관한 공사시방서가 없는 경우는 친환경 등급 SE0, 또는 포름알데히드를 포함한 접착제를 사용하지 않는 것으로 한다.(2) 기타 환경요구사항은 KCS 41 51 01 (1.6) 에 따른다.2. 자재2.1 목질계(1) 일반사항  ① 내장에 사용되는 목재류는 한국산업표준에 합격한 것으로 한다. 한국산업표준에 없는 것은 공사시방서에 따른다. ② 합판의 종류, 등급, 접착강도, 난연성, 표면판의 수종 및 치수 , 포름알데히드 방산량 등은 공사시방서에 따른다. 그 무늿결, 색깔 등은 견본을 제출하여 담당원의 승인을 받는다. ③ 섬유판은 한국산업표준에 적합한 것으로 하고,  종류, 형상, 치수, 포름알데히드 방산량 등은 한국산업표준에 의한다.  (2) 고정철물① 합판을 고정시키기 위해 사용하는 철물은 공사시방서에 따른다. 공사시방서가 없는 경우 못으로 한다.② 섬유판의 고정철물은 공사시방서에 따르며 공사시방서가 없는 경우에는 못, 나사 또는 스테이플로 한다.③ 재질은 강제로 하고, 치장용 바탕으로 이용하는 판에는 전기아연도금한 것을 사용하며, 치장판에는 전기아연도금에 도장한 것을 사용한다.④ 습기의 영향으로 녹슬기 쉬운 개소에 사용하는 못은 스테인리스강제로 한다.(3) 접착제접착제는 한국산업표준에 적합한 것으로 하고, 그 지정은 공사시방서에 의한다. 공사시방서가 없는 경우, 합판은 표 2.1-1, 섬유판은 표 2.1-2에 따른다.표 2.1-1 합판용 접착제 종류		접착제 붙임			못, 접착제 병용 붙임			영구고정인 경우			임시 고정하는 경우			합성고무계	용제형(양면도포)			초산비닐계 수지 에멀션형(한 면 도포)	합성고무계 용제형(양면 도포)			초산비닐계 수지 에멀젼형(한 면 도포)	합성고무계 용제형(양면 도포)	표 2.1-2 섬유판용 접착제의 종류		바탕종류			접착제			비   고			목제	단판적층재			초산비닐수지계 에멀션형	합성고무계 용제형			한 면 도포	양면 도포			강제			합성고무계 용제형(매스틱mastic 상)			 	양면 도포	(4) 기타 재료줄눈대, 누름대 등을 사용하는 경우, 종류, 형태, 치수는 공사시방서에 따른다.2.2 무기질계  무기질계 판 및 보드류는 한국산업표준에 적합한 것으로 하고, 종류, 형상 및 치수 등은 공사시방서에 따른다. 한국산업표준에 없는 경우에는 담당원이 승인한 것을 사용한다.(1) 패널류패널의 종류는 표 2.2-1을 표준으로 하고, 그 종별 및 수종의 지정은 공사시방서에 따른다.표 2.2-1 패널의 종별(단위：mm)		종별			A종			B종			C종			등급			1			2			3			크기			두께			9			너비			75			75			90			길이			500 이상	(2) 목모 보드① 한국산업표준에 합격한 것으로 하며, 기타 이와 유사한 성질의 것은 담당원이 승인한 것을 사용한다.② 목모 보드의 종류, 형상 및 치수 등은 공사시방서에 따른다.③ 고정용 철물가. 고정철물은 공사시방서에 의한다. 공사시방서가 없는 경우 못 또는 나사로 한다.나. 못, 나사류는 스테인리스강제로 한다.(3) 섬유강화 시멘트판① 한국산업표준에 합격한 것으로 하고, 한국산업표준 이외의 것을 사용하는 경우에는 담당원의 승인을 받으며, 2차 제품의 판 옆면의 방수처리는 공사시방서에 따른다.② 고정용 철물가. 섬유강화 시멘트판의 고정철물은 공사시방서에 의한다. 공사시방서가 없는 경우 못, 나사류로 한다. 치수는 공사시방서에 의한다.나. 재질은 강제 및 스테인리스강제로 하고, 치장용 바탕으로 이용하는 판에는 전기아연도금한 것을 사용하며, 치장판에는 전기아연도금에 도장한 것을 사용한다.③ 접착제는 한국산업표준에 적합한 것으로 하고 그 지정은 공사시방서에 의한다. 공사시방서가 없는 경우는 표 2.1-2에 의한다.④ 줄눈대, 누름대 등을 사용하는 경우, 종류, 형태, 치수는 공사시방서에 의한다.(4) 석고보드① 한국산업표준에 합격한 것으로 하고, 규격 외의 것을 사용할 때는 담당원의 승인을 받는다.② 고정용 철물가. 공사시방서에서 정한 바가 없을 때는 아래를 표준으로 하고 담당원의 지시를 따른다.나. 고정철물은 공사시방서가 없는 경우 표 2.2-2에 의한다.표 2.2-2 석고보드용 고정철물		보드 용도			보드붙임바탕			용도			고정철물			마감바탕			목제	단판적층재			프레임공법용			석고보드용 못			일반접합			석고보드용 못, 스테인리스강 못			강제			일반접합			드릴링 태핑나사			경접합			클립			마감			목제			일반접합			칼라 못			강제			치장			컬러스크루			석고보드			경접합			스테이플	다. 고정철물은 바탕종류, 인발내력, 보드두께, 환경조건에 의해서 선정한다.라. 석고보드용 못 및 드릴링 태핑나사는 한국산업 표준에 적합한 것으로 한다.마. 사용환경에 의해 고정용 철물의 부식이 예상되는 경우는 아연도금 또는 아연도금에 크롬산염 처리를 실시한 것 이외에 스테인리스강.황동제 또는 도장을 실시한 것을 사용한다.③ 접착제접착제는 한국산업표준에 적합한 것으로 하고, 그 지정은 공사시방서에 의한다. 공사시방서가 없는 경우에는 표 2.2-3에 의한다.표 2.2-3 접착제		접착바탕			성분			비고			목제	단판적층재			초산비닐(단면도포)	합성고무(양면도포)			에멀션형, 용제형(임시로 누름)	용제형			강제			초산비닐(단면도포)	합성고무(양면도포)			용제형(못, 작은 나사 병용)	용제형			콘크리트 모르타르, ALC, 벽돌, 압출성형판			 	석고계2)			직접 붙임형 접착제(임시로 누름)	직접 붙임용 접착제(임시 누름을 요함)			석고보드1)(덧붙임)			초산비닐(단면도포)			에멀션형, 용제형(임시로 누름)	     1) 습기의 염려가 있는 경우는 피복석고보드를 이용한다.     2) 석고보드 제조사가 지정하는 제품으로 한다. 포름알데히드 방산량 등급은 공사시방서에 의한다. 공사시방서가 없는 경우는 친환경 등급 SE0로 한다.④ 기타가. 줄눈처리용 조인트 시멘트는 한국산업표준에 적합한 것으로 한다.나. 줄눈처리용 조인트 테이프는 공사시방서에 의한다.다. 코너비드, 조이너 및 틈새 충전재 등은 공사시방서에 의한다.2.3 금속판계2.3.1 재료의 종류금속판류는 다음의 한국산업표준에 적합한 것으로 하고, 종류, 형상 및 치수 등은 공사시방서에 따른다. 한국산업표준에 없는 경우에는 담당원이 승인한 것을 사용한다.(1) 고정 철물① 금속판 고정에 사용되는 나사, 볼트류는 한국산업표준에 적합 것으로 하며 그 지정은 공사시방에 따른다. ② 부착 철물은 강제로 하며 아연도금, 유니크롬 처리한 것을 표준으로 한다.(2) 줄눈재줄눈재의 종류, 형상 및 치수는 공사시방에 따른다.2.3.2 재료의 반입 및 보관(1) 재료의 운반 및 보관에 주의하며 변형, 파손, 오염 등이 생기지 않도록 취급하며 재료는 정돈해서 보관하고 먼지나 오염이 발생되지 않도록 적절한 양생을 강구한다.(2)  금속판류의 반입 및 보관에 전용 컨테이너를 사용하는 경우 공사시방서에 따른다.3. 시공3.1 목질계(1) 합판붙임① 가공가. 합판의 절단은 톱 또는 전동톱을 이용해서 정확하게 실시한다.나. 판의 절단면이 부정형인 경우에는 대패 또는 연마지 등으로 평활하게 마무리한다.② 고정 가. 합판붙이기는 공사시방서에 따르며 걸레받이, 두겁대, 문꼴선, 돌림선, 기타와의 접합은 도면에 따라 시공한다. 판 옆을 맞출 때에는 틈, 턱솔 등이 없도록 하고 조이너를 붙여 댈 때에는 위치를 바르게 고정한다.나. 공사시방서가 없는 경우에는 못박기, 못과 접착제 병용 또는 접착붙임 중 어느 것으로 할 것인가를 담당원의 지시에 따른다.다. 못박기 하는 경우(가) 못길이는 판두께의 2.5배 이상을 표준으로 하고 충분한 고정강도가 얻어지는 것으로 한다.(나) 붙임간격은 못박기인 경우 판 주변에서 100mm, 중간부 150mm로, 못.접착제 병용인 경우에는 주변, 중간부 모두 350∼450mm로 하고, 연단거리는 약 10mm로 한다.(다) 합판의 치장널깔기의 경우에는 숨은 못박기로 하고, 두드러짐, 턱솔 등이 없도록 마무리한다.(라) 벽의 못박기는 판면에 처짐이나 우그러짐 등이 생기지 않도록 담당원의 지시에 따라 그 간격을 정한다.(마) 종이, 천류의 붙임 바탕이 되는 합판을 못박기하는 경우에는 녹막이 처리한 못을 사용하고, 기타 바탕 붙임용은 보통 못으로 한다. 이음은 맞댐이음으로 하고, 턱지지 않게 한다.라. 접착제를 사용하는 경우(가) 접착제는 그 종류에 따라서 판 또는 받이재 혹은 판 및 받이재에 필요한 양을 바른다.(나) 한 면 도포한 것은 도포 직후, 양면 도포한 것은 적당한 가용시간을 갖고 합판을 피접착면에 충분하게 눌러 붙여 밀착시킨다.마. 임시로 붙임을 실시하는 경우 판의 필요개소를 덧댐 나무로 누르거나, 줄눈 부분을 임시 붙임 못으로 박거나, 양면접착테이프를 범용하여 접착제가 경화될 때까지 적당한 방법으로 보양한다.바. 줄눈 또는 모서리 부분 등의 마무리는 공사시방서에 의한다.(2) 섬유판류① 가공가. 섬유판의 절단은 톱 또는 칼을 이용해서 정확하게 실시한다.나. 절단면이 부풀거나 부정형인 경우에는 대패질 또는 연마지 등으로 평활하게 마무리한다.다. 큰 면접기는 원칙적으로 기계가공으로 하고, 작은 면접기는 대패질 또는 연마지 닦기로 한다.라. 섬유판의 물축임은 판의 1변이 350mm 이상의 것에 대하여 하고, 물축임은 판을 붙여대기 1∼2일 전에 담당원의 지시에 따른다.② 붙임가. 섬유판의 고정방법은 공사시방서에 따르며, 공사시방서가 없는 경우는 표 3.1-1에 의해 담당원의 지시에 따른다.표 3.1-1 섬유판 고정방법(단위:mm)		바탕 종류			고정방법			설치간격			연단거리			주변부			중간부			목제	단판적층재			못박기 또는 스테이플 고정			100			150			10			못 또는 스테이플.접착제 병용			350∼450			강제			나사 고정			200			300			10			나사.접착제 병용			350∼450	나. 섬유판류는 설계도서 또는 담당원의 지시에 따라 벽나누기를 하고, 바닥과 들뜨지 않도록 붙여댄다. 벽은 중앙 부분부터 붙이기 시작하여 순차적으로 사방으로 향하여 붙여 나가야 하며, 두드러짐, 턱솔 등이 없도록 줄바르게 붙인다.다. 고정용 철물류는 줄바르게 동일한 간격으로 고정한다.라. 섬유판을 못 및 나사못류로 고정하는 경우(가) 못 또는 스테이플은 판두께 2.5배 이상으로 충분한 부착강도를 얻을수 있는 길이의 것을 이용한다. 나사못은 강제바탕 이면에 10mm 이상의 여장길이가 얻어질 수 있는 것을 사용한다.(나) 치장바탕으로 이용하는 판인 경우에 고정용 철물의 머리가 판면에 박히도록, 치장판인 경우에는 동일면이 되도록 박는다.(다) 판 주변부로부터 10mm 미만에 고정용 철물을 댈 경우, 또는 기타 위치에 있어서 판이 갈라질 우려가 있을 경우에는 담당원의 지시에 따라 전기드릴 또는 송곳을 사용하여 구멍을 뚫고 시공한다.마. 섬유판을 접착제로 붙여대는 경우(가) 접착제는 판과 받이재에 필요량을 바른 다음 충분히 눌러 대고, 접착제가 경화할 때까지 임시 누름대 등으로 눌러둔다.(나) 한 면 도포한 것은 도포 직후, 양면 도포한 것은 적당한 가용시간을 갖고 충분하게 누른 후 붙인다.(다) 시공환경에의 조치       1) 접착제를 사용하는 경우 시공 중 또는 접착제의 경화전에 실온이 5℃이하로 될 염려가 있는 경우에는  난방 등의 조치를 실시한다.       2) 실내의 습도가 높은 경우에는 통풍.환기 등을 실시한다.       3) 용제형의 접착제를 사용하는 경우에는 화기에 주의하여 환기 등의 조치를 실시한다.바. 줄눈 또는 모서리 부분 등의 마무리는 공사시방서에 의한다. 비가 들이치는 벽, 천장 붙임은 도면에 따르고, 줄눈대, 누름선 및 판의 이음 개소 등은 비아무림에 주의하여 붙여댄다.3.2 무기질계(1) 패널류① 공법가. 패널과 걸레받이 및 문꼴선 등의 접합은 도면에 따라 시공한다.나. 판의 이음 위치는 받이재 중심으로 한다. 판 마구리에 이음가공이 있는 경우에는 받이재에 관계없이 엇갈림 이음으로 할 수 있다.다. 붙여대기는 두드러짐이나 턱솔이 지지 않게 하고 줄바르게 충분히 밀착시켜 받이재에 숨긴다.② 보양붙여댄 후에는 담당원의 지시에 따라 종이붙임, 널대기 등으로 표면에 손상을 주지 않도록 보양한다.(2) 목모 보드① 가공절단은 전동식 톱 또는 톱으로 하며, 큰 면접기는 원칙적으로 기계가공으로 한다.② 공법가. 목모 보드의 고정방법은 공사시방서에 의하며, 공사시방서가 없는 경우는 표 3.2-1에 의한다.표 3.2-1 목모 보드의 고정방법 및 설치간격(단위：mm)		바탕종류			고정방법			붙임간격			연단거리			주변부			중간부			목  제			못박기			100			150			20			강  제			나사조임			200			200			20	  나. 판은 줄바르게 동일한 간격으로 고정시키며, 이음, 쪽매 등의 위치는 정확하고 줄바르게 하고, 두드러짐, 턱솔 등이 없도록 붙여댄다.다. 고정철물에 의한 붙임은 원칙적으로 아래에 의한다.(가) 못은 판두께의 3배를 원칙으로 하고, 충분한 고정강도를 얻을 수 있는 길이를 갖는 것을 사용하고 나사는 강제바탕 이면에 10mm 이상의 여장길이를 확보할 수 있는 것을 사용한다. (나) 치장바탕재로 이용될 경우는 고정철물의 머리가 목모 보드면에 묻힐 때까지 박고, 치장판으로 사용될 경우에는 판과 동일한 면이 되도록 못을 치거나 조인다.라. 줄눈의 형상, 치수 등은 공사시방서에 의한다.(3) 섬유강화 시멘트판① 가공가. 섬유강화 시멘트판의 절단은 종류에 따라 보드 커터, 섬유보강 시멘트판용 톱 또는 회전식 절단기를 사용한다. 다만, 얇은 판일 때에는 표면에 톱날 등으로 금긋기 자국을 내고 구부려서 절단할 수 있다. 이 경우 절단면은 줄 등으로 마무리한다.나. 고정용 구멍 뚫기에는 전기드릴을 사용한다. 구멍 직경은 사용하는 고정 철물의 직경보다 약간 크게 한다.다. 면접기는 설계도서에 따라 그라인더 또는 줄칼을 사용하여 평활하게 마무리한다.② 고정가. 섬유강화 시멘트판의 고정방법 및 설치간격은 공사시방서에 의하며, 공사시방서가 없는 경우에는 표 3.2-2에 의한다.표 3.2-2 섬유강화 시멘트판 고정방법 및 설치간격(단위：mm)		바탕종류			고정방법			설치간격			연단거리			주변부			중간부			목 제			못박기			300 이하			300 이하			 	15 이상			못, 접착제 병용			300∼450			강 제			나사고정			300 이하			300 이하			15 이상			나사, 접착제 병용			300∼450	나. 판은 줄눈이 일치해야 하며, 둔덕이나 줄눈이 일치하도록 고정한다.다. 고정용 철물은 줄눈이 일치하고 동일한 간격으로 고정한다.라. 고정용 철물로 못이나 나사를 사용할 경우 못길이는 판두께의 3배 이상으로 충분한 부착강도를 얻을 수 있는 것을 이용하며, 나사는 강제 바탕 이면에 10mm 이상의 여장을 확보할 수 있는 것을 사용한다.마. 줄눈의 형상, 치수 등은 공사시방서에 의한다.바. 벽은 이음 등의 위치를 바르게 하고 어떠한 경우도 줄눈이 일치하도록 한다.(4) 석고보드① 가공가. 절단은 전동식 절단기나 칼 등을 사용하여 정확하게 하며 줄칼질은 피한다.나. 물과 접할 가능성이 있는 절단면 및 다른 작은 구멍 부분을 방수처리 한다.② 공법가. 석고보드의 고정방법 및 설치간격은 표 3.2-3과 같다. 표 3.2-3 석고보드 고정방법 및 설치간격(단위：mm)		바탕			고정방법			설치간격			주변부			중간부			목제			못			100∼150			150∼200			못.접착제 병용			350∼450			강제			드릴링 태핑나사			200			300			클립			세로 300			가로 225			콘크리트, ALC,	콘크리트 블록			접착제	(직접 붙임용제)			150∼200*			바닥 1.2m 이하			바닥 1.2m 이상			200∼2501)			250∼3001)			주 1)은 도포한 접착제의 중심간 거리임.	나. 석고보드 주변부의 고정은 단부로부터 10mm 내외 외측 위치에서 한다.다. 목제 바탕에 못을 박는 경우 못길이는 보드 두께의 3~4배 정도의 것을 사용하며, 보드면과 평탄하게 될 때까지 충분히 타격한다.라. 강제 바탕에 보드를 붙이는 경우 강제 바탕 이면에 10mm 이상의 여장을 확보할 수 있는 드릴링 탭핑 나사를 이용하고 나사머리가 보드면 보다 깊게 박힐 때까지 조인다.마. 콘크리트 바탕 등에 직접 접착하는 경우는 접착제를 띠모양으로 도포한 후 충분히 압착한다.바. 이중 붙임인 경우 윗부분은 접착제와 함께 스테이플을 이용하여 가로, 세로 200∼300mm 간격으로 붙인다. 윗부분과 아래 붙임의 줄눈은 동일 위치에 놓이지 않도록 한다.사. 벽은 세로줄눈이 일치하도록 붙인다.③ 줄눈처리가. 석고보드의 줄눈처리는 에지 종류에 따라 실시하며 사용보드의 공사시방서에 의한다.나. 모서리 부분의 처리는 공사시방서에 의한다.3.3 금속판계(1) 시공도에 따라 기준먹을 기준으로 정확하게 먹내기한 후 금속판을 나누기한다.(2) 금속판을 가설치한 후 마감면의 울퉁불퉁함, 수직방향의 위치 및 줄눈폭을 조정한다.(3) 금속판은 나사, 볼트류를 이용해서 스터드에 고정한다.(4) 금속판 고정 후 마른걸레 등으로 청소한다.",Wall construction,"1. General Provisions ""1.1 Scope of this standard applies to materials and methods used in interior walls of buildings."" 1.2 Reference Standards 1. 2.1 Related Regulations KCS 41 51 01 ( 1. complies with 2.1) 1. 2.2 Relevant Standards● KS F 3104 (Particleboard)● KS F 3101 (Common Plywood)● KS F 3103 (Flooring Board)● KS F 3104 (Particleboard)● KS F 3200 (Fiberboard)● KS F 3129 (Wood Wall Panel)● KS F 4720 (Wood Wool Board) 1.3 Definitions KCS 41 51 01 ("" complies with 1.3) 1.4 Submission KCS 41 51 01 ( complies with 1.4) 1.5 Quality Assurance KCS 41 51 01 ( conforms to 1.5) 1.6 Environmental Considerations (1) In cases where there are no construction specifications regarding formaldehyde emission grade, an eco-friendly grade of SE0 shall be applied, or adhesives containing formaldehyde shall not be used. (2) Other environmental requirements shall be in accordance with KCS 41 51 01 ("" Complies with 1.6). 2. Materials 2.1 Woodwork (1) General Requirements ① Wood materials used for interior finishing shall comply with the Korean Industrial Standards. If not covered by the Korean Industrial Standards, they shall be in accordance with the project specifications. ② The type, grade, adhesive strength, fire resistance, species and dimensions of the surface veneer, and formaldehyde emission rate of plywood shall be in accordance with the project specifications. The joint details, color, etc., shall be approved by the responsible party after submitting samples. ③ Fiberboard shall conform to the Korean Industrial Standards, and its type, shape, dimensions, and formaldehyde emission rate shall be in accordance with the Korean Industrial Standards. (2) Fasteners ① Fasteners used to fix plywood shall be in accordance with the project specifications. If there are no project specifications, nails shall be used. ② Fasteners for fiberboard shall be in accordance with the project specifications; if there are no project specifications, nails, screws, or staples shall be used. ③ The material shall be steel, and for panels used as a decorative base, electrogalvanized steel shall be used; for decorative panels, steel electrogalvanized and painted shall be used. ④ Nails used in areas prone to rust due to moisture shall be stainless steel. (3) Adhesives Adhesives shall comply with the Korean Industrial Standards, and their designation shall be in accordance with the project specifications. If there are no project specifications, plywood shall be… 2.1-1, the fiberboard is a table. Follows Table according to 2.1-2. 2.1-1 Types of Adhesives for Plywood		Adhesive Bonding Only		Bonding with Nails and Adhesive		For Permanent Fixing		For Temporary Fixing		Synthetic Rubber-based	Solvent-based (Double-sided application)			Vinyl Acetate Resin Emulsion-based (Single-side application)		Synthetic Rubber-based Solvent-based (Double-sided application)			Vinyl Acetate Resin Emulsion-based (Single-side application)		Synthetic Rubber-based Solvent-based (Double-sided application)	Table 2.1-2 Types of Adhesives for Fiberboard		Substrate			Adhesive			Remarks			Wood	Plywood			Vinyl Acetate Resin Emulsion	Synthetic Rubber Solvent-based			Single-sided application	Double-sided application			Forced			Synthetic Rubber Solvent-based (Mastic type)			 	Double-sided application (4) For other materials, such as joint fillers and pressure strips, the type, shape, and dimensions shall comply with the construction specifications. 2.2 Inorganic panels and boards shall conform to Korean Industrial Standards, and their type, form, and dimensions shall be in accordance with the project specifications. If not covered by the Korean Industrial Standards, materials approved by the responsible person shall be used. (1) Panel types are listed in the table. ""2.2-1 shall be the standard, and the designation of species and varieties shall be in accordance with the contract specifications. Table"" 2.2-1 Panel Specifications (Unit: mm)		Type			A Type			B Type			C Type			Grade			1			2			3			Size			Thickness			9			Width			75			75			90			Length			500 or more (2) Wood Wool Board① Shall comply with the Korean Industrial Standards; other materials with similar properties shall be approved by the responsible person. ② The type, shape, and dimensions of the wood wool board shall be in accordance with the construction specifications. ③ Fixing hardware. The fixing hardware shall be in accordance with the construction specifications. If there are no construction specifications, nails or screws shall be used.  a. Nails and screws shall be stainless steel. (3) Fiber Reinforced Cement Board① Shall comply with the Korean Industrial Standards; if materials other than the Korean Industrial Standards are used, the approval of the responsible person shall be obtained, and the waterproofing treatment on the side surface of the secondary product panel shall be in accordance with the construction specifications. ② Fixing hardware. The fixing hardware for the fiber reinforced cement board shall be in accordance with the construction specifications. If there are no construction specifications, nails and screws shall be used. Dimensions shall be in accordance with the construction specifications. a. The material shall be galvanized steel and stainless steel; panels used as decorative base materials shall be electro-galvanized, and decorative panels shall be electro-galvanized and painted. ③ Adhesives shall be suitable for the Korean Industrial Standards, and their designation shall be in accordance with the construction specifications. If there are no construction specifications, refer to the table. According to 2.1-2④, when using joint strips, pressing strips, etc., the type, form, and dimensions shall be in accordance with the specifications. (4) Gypsum board shall conform to the Korean Industrial Standards, and the approval of the responsible person shall be obtained when using specifications other than those specified. ② Fixing hardware. If not specified in the specifications, the following shall be used as a standard and the instructions of the responsible person shall be followed. b. Fixing hardware when there are no specifications shall be in the table. According to Table 2.2-2. 2.2-2 Drywall Fixing Devices		Board Application			Base Material			Application			Fixing Devices			Finishing Material			Wood	Engineered Wood			Frame Construction			Drywall Nails			Common Joint			Drywall Nails, Stainless Steel Nails			Forced Connection			Common Joint			Drilling Tapping Screws			Strong Joint			Clips			Finishing			Wood			Common Joint			Colored Nails			Forced Connection			Decorative			Colored Screws			Drywall			Strong Joint			Staples	c. Fixing devices shall be selected based on the type of base material, pull-out strength, board thickness, and environmental conditions. d. Drywall nails and drilling tapping screws shall conform to the Korean Industrial Standard. e. In cases where corrosion of fixing devices is anticipated due to the usage environment, stainless steel, brass, or coated materials, other than those with galvanized or chromate-treated galvanized coating, shall be used. ③ Adhesives Adhesives shall conform to the Korean Industrial Standard, and their specification shall be in accordance with the construction specifications. If there are no construction specifications, refer to the table. According to Table 2.2-3. 2.2-3 Adhesives

| Substrate | Component | Remarks |
|---|---|---|
| Wood | Plywood/Laminated Wood | Polyvinyl Acetate (single-coat application) Synthetic Rubber (double-coat application) | Emulsion type, Solvent type (temporary pressing) |
| Forced | Polyvinyl Acetate (single-coat application) Synthetic Rubber (double-coat application) | Solvent type (use with nails or small screws) |
| Concrete mortar, ALC, Brick, Extruded Panel |  |  | Solvent type |
| Gypsum-based (2) |  |  Direct bonding adhesive (temporary pressing) Direct bonding adhesive (requires temporary pressing) |
| Gypsum board (1) (overlay) | Polyvinyl Acetate (single-coat application) | Emulsion type, Solvent type (temporary pressing) |

1) Use coated gypsum board if moisture is a concern.
2) Use products designated by the gypsum board manufacturer. The formaldehyde emission rating shall be in accordance with the construction specifications. If there are no construction specifications, use the environmentally friendly grade SE0. ④ Others. a. Joint cement for joint finishing shall be in accordance with the Korean Industrial Standard. b. Joint tape for joint finishing shall be in accordance with the construction specifications. c. Corner beads, joiners, and gap fillers, etc., shall be in accordance with the construction specifications. 2.3 Metallic Plate System 2. 3.1 Materials - Metal Sheets
The metal sheets shall conform to the following Korean Industrial Standards, and the type, shape, and dimensions shall be in accordance with the project specifications. If not covered by the Korean Industrial Standards, materials approved by the responsible person shall be used. (1) Fixing Hardware ① Screws, bolts, and other fasteners used for fixing metal sheets shall conform to the Korean Industrial Standards, and their specifications shall be in accordance with the project specifications. ② Attachment hardware shall be galvanized and chromated. (2) Joint Fillers The type, shape, and dimensions of the joint fillers shall be in accordance with the project specifications. 2. 3.2 Material Handling and Storage (1) Handle materials with care during transportation and storage to prevent deformation, damage, or contamination. Store materials neatly and take appropriate curing measures to prevent dust or contamination. (2) When dedicated containers are used for the handling and storage of metal sheets, comply with the project specifications. 3. Construction 3.1 Woodwork (1) Plywood Bonding ① Processing. The cutting of plywood shall be performed accurately using a saw or power saw. b. If the cut surface of the panel is irregular, it shall be finished smoothly with a hand plane or sandpaper. ② Fixing a. Plywood bonding shall comply with the construction specifications, and connections with baseboards, sleepers, door frames, moldings, and others shall be constructed according to the drawings. When matching the sides of the panels, gaps and misalignments shall be prevented, and when attaching joiners, they shall be fixed in the correct position. b. If there are no construction specifications, the method of nailing, using nails and adhesive together, or adhesive bonding shall be determined according to the instructions of the supervisor. c. In the case of nailing (a) the length of the nails is based on the panel thickness. 2.5 times or more shall be adopted as the standard, ensuring sufficient fixing strength. (b) When nailing, the spacing shall be 100mm around the edges and 150mm in the middle of the panel; when using nails and adhesive together, the spacing shall be 350∼450mm around the edges and in the middle, and the staggering distance shall be approximately 10mm. (c) For decorative veneer of plywood, concealed nailing shall be used, and the surface shall be finished to eliminate any protrusions or saw marks. (d) When nailing walls, the spacing shall be determined according to the responsible person’s instructions to prevent sagging or warping of the panel. (e) When nailing plywood used as a backing for paper or fabric, rust-proof nails shall be used; for other backing applications, ordinary nails shall be used. Joints shall be made with butt joints and shall be flush. (d) When using adhesive (a) Apply the required amount of adhesive according to the type of adhesive to the panel, the receiving member, or both the panel and the receiving member. (b) After applying to one side, attach the plywood to the bonding surface with sufficient pressure immediately after application; after applying to both sides, allow for a suitable open time and attach the plywood to the bonding surface with sufficient pressure to ensure close contact. (e) When temporary bonding is performed, press down the required parts of the panel with shim wood, nail the seams with temporary nails, or use double-sided tape universally and secure the panel in an appropriate manner until the adhesive is cured. (f) Finishing of seams or edges shall be in accordance with the construction specifications. (2) Fiberboard① Processing a. Fiberboard shall be cut precisely using a saw or knife. b. If the cut surface is uneven or deformed, smooth it with a plane or sandpaper. c. Large-area bonding should be performed primarily by machine processing, and small-area bonding should be performed by planing or sanding. d. Fiberboard should be seasoned when one side of the panel is 350mm or more; the seasoning should be done 1∼2 days before applying the panel, according to the responsible person’s instructions. ② Attachment a. The fixing method for fiberboard shall comply with the construction specifications; if there are no construction specifications, refer to the table. Follows the instructions of the responsible person according to 3.1-1. Table 3.1-1 Fiberboard Fixing Method (Unit: mm)		Base Material			Fixing Method			Installation Interval			Spacing			Perimeter			Center			Wood	Laminated Single Sheet			Nailing or Staple Fixing			100			150			10			Nails or Staples, Adhesive Combined			350∼450			Forced			Screw Fixing			200			300			10			Screws, Adhesive Combined			350∼450	B. Fiberboard panels shall be partitioned according to the design specifications or the instructions of the responsible person, and adhered so as not to lift from the floor. Walls should be started from the center and sequentially applied outward. They should be applied neatly to avoid unevenness, warps, etc. C. Fixing hardware shall be fixed at regular intervals. D. When fixing fiberboard with nails and screws (a) Nails or staples should be based on the panel thickness. Use fasteners with a length sufficient to achieve at least 2.5 times the required bonding strength. Screws should be used with a minimum of 10mm of embedment beyond the base material. (b) When installing panels on decorative backing, ensure the head of the fixing hardware is flush with the surface of the panel. When installing decorative panels, ensure the fixing hardware is flush with the same surface. (c) If fixing hardware is to be positioned within 10mm of the panel edge, or if there is a risk of cracking in other locations, drill holes using an electric drill or awl as directed by the supervisor. E. When bonding fiber panels with adhesive (a) Apply the necessary amount of adhesive to both the panel and the substrate, press firmly together, and hold in place with temporary clamps until the adhesive has cured. (b) For single-surface application, apply and bond immediately. For double-surface application, allow for an appropriate open time and then bond securely. F. Environmental conditions during installation 1) If there is a risk of the ambient temperature falling below 5°C during installation or before the adhesive has fully cured, take measures such as heating. 2) If the indoor humidity is high, ensure adequate ventilation. 3) When using solvent-based adhesives, exercise caution with fire hazards and ensure adequate ventilation. G. Finishing of joints and edges shall be in accordance with the project specifications. Waterproofing of walls and ceilings shall be in accordance with the drawings, and joints, caulking lines, and panel seams shall be carefully sealed to prevent water intrusion. 3.2 Inorganic Materials (1) Panel Work① Construction Method. The joining of panels, baseboards, and moldings shall be carried out according to the drawings. b. The joint location of the panels shall be centered on the supporting member. If the edge of the panel has a joint, it can be joined with a staggered joint regardless of the supporting member. c. The application of the overlay shall be done without any protrusions or gaps and shall be tightly fitted and concealed by the supporting member. ② After applying the overlay, protect the surface with paper, battens, etc., according to the supervisor's instructions to prevent damage. (2) Wood Wool Board ① Cutting shall be performed with a power saw or saw, and large-area cutting shall be performed by machine processing in principle. ② Construction Method. The fixing method for wood wool board shall be in accordance with the construction specifications; if there are no construction specifications, refer to the table. According to Table 3.2-1. 3.2-1 Wood Frame Fixing Methods and Installation Intervals (Unit: mm)

| Base Type | Fixing Method | Spacing | Overhang | Peripheral Area | Intermediate Area |
|---|---|---|---|---|---|
| Wood | Nail | 100 | 150 | 20 |  |
| Steel | Screw | 200 | 200 | 20 |  |

b. Panels shall be fixed at uniform intervals, and joints, splices, etc., shall be accurately and consistently aligned, and applied without protrusions or unevenness.
c. Fixing with fasteners shall generally be as follows: (a) Nails shall be used at a minimum of 3 times the panel thickness, and shall have a sufficient length to obtain adequate fixing strength. Screws shall be used with a minimum of 10mm of thread engagement into the steel base. (b) When used as a decorative baseboard, nails shall be driven until the head of the fastener is flush with the wood frame surface. When used as a decorative panel, nails or screws shall be driven so that the surface is flush with the panel.
d. Details of joint profiles and dimensions shall be in accordance with the construction specifications.

(3) Fiber Reinforced Cement Board
① Processing
a. Cutting of fiber reinforced cement board shall be performed using a board cutter, fiber reinforced cement board saw, or rotary cutter, depending on the type. However, for thin boards, they can be cut by scoring the surface with a saw blade and bending. In this case, the cut surface shall be finished with a file or similar tool.
b. For drilling fixing holes, an electric drill shall be used. The hole diameter shall be slightly larger than the diameter of the fixing fastener being used.
c. The surface finishing shall be performed smoothly using a grinder or file according to the design drawings.
② Fixing
a. The fixing method and installation interval of the fiber reinforced cement board shall be in accordance with the construction specifications. If there are no construction specifications, refer to the table. According to Table in 3.2-2. 3.2-2 Fiber Cement Board Fixing Methods and Installation Intervals (Units: mm)

| Base Type | Fixing Method | Installation Interval | Edge Distance | Perimeter Area | Central Area |
|---|---|---|---|---|---|
| Wood | Nail | 300 mm or less | 300 mm or less | 15 mm or more |  |
| Wood | Nails and Adhesive | 300-450 mm |  |  |
| Reinforced Concrete | Screw Fixing | 300 mm or less | 300 mm or less | 15 mm or more |  |
| Reinforced Concrete | Screws and Adhesive | 300-450 mm |  |  |

b. The panels shall be aligned at the joints, and fixed to match the ridges or joints.
c. Fixing hardware shall be installed at the joints and at uniform intervals.
d. When using nails or screws as fixing hardware, the nail length shall be at least three times the panel thickness to ensure sufficient bonding strength, and screws shall allow for a minimum of 10 mm embedment into the substrate.
e. Joint shape and dimensions shall be in accordance with the construction specifications.
f. Walls shall be properly aligned, including joints, and the joints shall be aligned in all cases.

(4) Gypsum Board
① Processing
a. Cutting shall be performed precisely using an electric cutter or a knife, and scoring shall be avoided.
b. Waterproofing shall be applied to cut edges and other small holes that may come into contact with water.
② Construction Method
a. The fixing method and installation interval for gypsum boards shall be according to the table. It is the same as 3.2-3. Table. 3.2-3 Drywall Fixing Methods and Installation Intervals (Unit: mm)		Base			Fixing Method			Installation Interval			Perimeter			Center			Wood			Nails			100∼150			150∼200			Nails and Adhesive Combination			350∼450			Forced			Drilling Tapping Screws			200			300			Clip			Vertical 300			Horizontal 225			Concrete, ALC,	Concrete Block			Adhesive	(Direct Bonding Adhesive)			150∼200*			Floor Floor with a height of 1.2m or less 1.2m or more 200∼2501) 250∼3001) Note 1) refers to the distance between the centers of the applied adhesive. B. Fixing the edges of the gypsum board shall be done at a position approximately 10mm outward from the end. C. When nailing into a wooden base, use nails that are approximately 3~4 times the thickness of the board and drive them in sufficiently until the nail head is flush with the board surface. D. When attaching the board to a metal base, use drilling tapping screws that can secure a margin of 10mm or more on the back of the metal base and tighten them until the screw head is recessed below the board surface. E. When directly adhering to a concrete base, etc., apply adhesive in a strip pattern and press firmly. F. For double layering, the top layer shall be attached with staples along with the adhesive at intervals of 200∼300mm horizontally and vertically. Ensure that the joints of the top and bottom layers are not in the same position. G. When installing walls, align the vertical joints. ③ Joint treatment A. The joint treatment of gypsum boards shall be performed according to the edge type and according to the construction specifications of the used board. B. The treatment of corner portions shall be in accordance with the construction specifications. 3.3 Metal Panel System (1) After accurately marking the metal panels based on the layout drawing and reference points, divide the panels. (2) Temporarily install the metal panels and adjust the surface irregularities, vertical alignment, and joint width. (3) Secure the metal panels to the studs using screws and bolts. (4) After securing the metal panels, clean them with a dry cloth or similar material."
