codeType,code,name,contents,name_en,contents_en
KDS,676013,개간 영농계획,"1. 일반사항1.1 목적개간지에 작물을 농업경영에 도입하여 합리적인 경영에 의하여 소득을 높이려면 우선 지역의 입지조건에 적절한 재배작물을 선정하여 생산성과 수익성이 확보 되도록 하여야 한다.1.2 적용범위. 내용 없음1.3 참고기준. 농림부, 2006, 농업생산기반정비사업계획 설계기준 개간 편1.4 용어의 정의. 내용 없음1.5 기호의 정의. 내용 없음2. 조사 및 계획2.1 작물2.1.1 작물 선택상의 유의점영농상 적합한 작물은 자연적인 재배환경에 잘 적응하여야 하며 경영, 경제적으로 유리한 조건을 구비하여야 한다. 그러므로 작물을 선택하는 데는 먼저 기상, 토양 등의 자연환경에 적합한 종류를 고르고, 그 중에서 가장 수익성이 높은 것을 선택하도록 한다. 그런데 같은 작물 중에서도 품종에 따라서 환경 적응성이 다르고 품질에 차이가 있어서 수익성도 다른 경우가 많으므로, 개간지에서는 우선 기상.토양 등의 자연재배환경을 과학적으로 면밀히 조사한다. 이 중에서 기상환경은 해마다 일정하지는 않지만 다년간의 경험과 개간지 인근에 있는 기상관측소 및 그 관련기관이나 농촌진흥청, 각도 농업기술원, 각시군 농업기술센터 등에서 관측한 결과를 참고로 할 수 있으므로 비교적 용이한 편이다. 그러나 토양환경은 지역에 따라서 차이가 심하고, 특히 전혀 작물을 재배한 바 없는 새로운 개간지는 경험이나 육안으로는 충분히 토양의 특성을 파악할 수 없으므로 관계기관에 의뢰하여 물리화학적인 분석을 하도록 하며, 이러한 토양 조사는 개간지 개량의 기초 자료로도 중요하다. 분석조사가 곤란한 경우에는 개간지와 비슷한 다른 지역 기개간지의 실례를 조사하여 참고로 한다.또한, 경영.경제적 조건이 유리하여 수익성이 높아야 하므로 재배목적(이용성), 토지이용도, 노동력 확보, 경제적 입지조건(시장성) 등 여러 가지 사항에 대한 충분한 연구와 배려를 하여 재배작물을 선택한다.2.1.2 작물의 작부계획작부체계는 일정한 토지에 몇 가지 작물을 조합하여 일정한 순서로 순환적으로 재배하는 방식을 말한다. 작부체계에는 재배되는 전후 작물의 조합과 동시에 간작, 혼작 등의 공간적인 조합인 협의의 작부체계와 작물의 조합뿐 만 아니라 재배하는 작물의 생산을 위해 필요한 자원관리, 자재투입, 재배기술 등을 포함한 광의의 작부체계가 있다.작물을 재배하려면 포장에 어떤 작물을 어떤 순서로 작부할 것이냐 하는 계획을 수립해야 한다. 작물을 선택할 때는 작부계획을 염두에 두고 하여야 하지만 이것은 불변인 것은 물론 아니고 수요의 변동 경영형태와 규모의 변화 지력의 변화 등에 따라 항상 변한다. 특히 신개간지에서는 토양이 개량될 때까지는 지력을 고려하고 재배가 가능한 작물로서 순차적으로 그 개량에 도움이 되는 작부방식을 수립한다. 3. 재료. 내용 없음4. 설계4.1 지력의 증진개간지 농업의 성공여부는 그 토양의 지력에 따라 달라진다. 우리나라는 밭토양이 논토양보다 지력이 낮으며 생산기반조성이 상대적으로 부족한 실정이다. 기경작 되고 있는 밭도 같은 조건이며 개간지 밭은 대체로 산성이다. 또한, 부식과 점토가 적고, 토양구조가 불량하며, 인산을 위시한 비료성분도 적어서 더욱 지력이 낮은 것이 일반적이므로 우선 영농의 목표는 토양의 물리.화학적 성질을 개선하여 토양의 비옥도(지력)를 높이도록 해야 한다.4.1.1 개간지 토양의 특성개간지 토양을 숙전화 하기 위해서는 물리적 성질 개량과 함께 토양산성의 교정, 유기질비료의 증시 등 화학적 성질을 개량하여야 하며 토양침식의 방지도 병행하여야 한다.(1) 개간지 토양의 물리적 성질① 개간지 토양은 주로 구릉지대나 경사지이기 때문에 경사지형을 하고 있다. 따라서 토양침식이 크고 토양단면은 표층이 얇으며 공극률이 낮고 고상비율이 커서 경토의 가비중도 크다.② 개간지는 기경지에 비하여 액상공극량은 많으나 기상공극량이 매우 적으며 전공극량도 기경지 숙전(熟田)에 비해 매우 작은데 이는 대공극이 적기 때문이다. 또한 개간지는 토양구조(soil structure)가 발달되지 못하고 경사지이기 때문에 강수의 지중침투의 기회가 적고 유실되기 때문이다. 그리고 토양의 보수력이 낮아서 한해를 받기 쉬운 조건에 있다.③ 토성(soil texture)은 사질인 경우가 많고 식질의 경우에는 점토함량이  과다한 경우가 많다.④ 이밖에 개간지토양은 경도가 커서 경운(ploughing)이 곤란하며, 유효심토(경토의 두께)가 낮아 작물의 정상생육이 대체로 곤란하다.(2) 개간지 토양의 화학적 성질① 개간지 토양은 기경지 숙전에 비하여 이미 산성화된 토양이거나 경사지 또는 기복지에 위치하므로 산성화되기 쉬운 조건에 있다. 따라서 화학적 성질의 면에서도 작물의 정상생육이 곤란한 상태에 있다.② 작토의 pH는 대부분 5.3 이하로 산성화되어 있으며, 유효인산의 함량이 4.2ppm 이하로 매우 적어 인산의 흡수계수가 600~2,000(mg/100g)으로 매우 높다.③ 또한, 개간지 경토의 유기물함량(有機物含量)은 1.0% 이내로 매우 빈약하고 미량 요소도 매우 결핍되어 있으며, 치환성염기 특히 Ca, Mg, KO2, Na 등의 함량이 기경지에 비하여 극히 낮아 염기포화도(%)는 25% 내외에 불과하여 완충능(緩衝能)도 적은 것이 큰 특징이다.④ 이러한 원인은 우리나라 토양의 모재가 산성암인 화강암과 화강편마암에서 유래되었다는 사실과 장기간동안 강우 등에 의해 나지상태에서 염기의 용탈이 이루어졌기 때문이다. 또한 유기물함량이 낮은 것은 경사지나 기복지이기 때문에 토양침식이 크게 작용하여 유거수와 함께 이들 유기물이 유실되었기 때문이다.(1) 개간지는 주로 밭으로 이용되는데 대부분 부식이 극히 부족하거나 미숙한 부식이 많은 경우(산간지)가 있고, 인산, 마그네슘, 망간, 붕소 등의 미량원소가 적게 함유되어 있으며, 산성이 강하고 경사지가 많아서 토양의 침식이 심한 것이 일반적이다. 강산성토양에서는 유용한 미생물의 활동이 저해되어 유기물의 분해가 잘 되지 않고 암모니아의 흡수력이 약해서 시용해도 용탈되어 비료성분의 손실이 커지며 인산은 시용해도 불용성이 되어 효과를 볼 수 없고 알루미늄 등 유해한 이온이 용출되어 해로운 등 여러 가지 원인 때문에 작물생육에 해롭다. 4.1.2 지력증진 방법새로 조성되는 개간지의 지력 증진을 위해서는 토심의 증대, 유기물의 시용, 석회질 및 인산질 비료의 시용과 토양보전을 위한 대책을 수립하여야 한다.(1) 토심(土深)의 증대① 개간지토양은 표토가 유실되어 작토가 얇고 대부분 잔적토이므로 토양의 경도가 매우 크다. 따라서 작토의 증대를 위한 심경(深耕)이 필요하므로 기계력 등을 이용하여 우선 심경에 주력하여야 한다.② 개간지 토양은 토양의 경도가 커서 경운이 곤란한 점이 있으나 농용석회의 시용과 다량의 유기물질의 시용으로 가비중을 감소시킴으로써 점차 경도의 개선이 이루어질 것이며, 동시에 작토의 보수력, 투수력의 향상과 작물근역분포범위의 확대 등으로 심층토의 풍화가 촉진되어 유효토심(작토)도 점차 증대된다.③ 유효토심을 증대시키기 위해서는 심경을 하여야 하나 이때는 유기물.농용석회 기타 시비량을 증대시켜야 하며, 이것이 또한 유효토심의 증대에 크게 기여한다.(2) 유기물의 다량 시용① 개간지토양은 가속침식(加速侵蝕)으로 인하여 표토의 유실이 많고 부식이 집적될 시간적인 여유가 없으며 대체로 유기물함량이 극히 낮다. 즉 개간지토양의 유기물함량은 1%내외로 기경지숙전의 1/2 정도이므로 다량의 유기물이 필요하다.② 작토의 유기물함량을 제고하기 위한 잠정적 방법으로는 작토중의 유기물함량이 소정의 목표함량(2∼3%)으로 유지되게 하기 위하여 유기물투입량을 산정하여야 한다.③ 완숙퇴비는 부숙도가 30% 정도이나 개간지에 있어서는 다량의 유기물시용을 요하며, 가속침식의 방지는 물론 보수력 등도 큰 문제가 되므로 생짚 등 미숙 퇴구비(manure)를 부초(敷草)하여 유효수분 보존, 토양유실방지를 기한 후 이를 갈아 엎어서 유기물증대를 도모하는 방법도 적용되어야 한다.④ 이와 같은 방법으로 유기물질이 작토층에 투입되면 토양미생물에 의해 무기화되는 과정에서 미숙부식이나 균사, 폴리우러나이드(polyuronide) 등에 의해 토양의 미세입자들이 입단화되고 따라서 대공극이 증가되어 기상비율과 전공극량이 증대되어 보수력과 투수력 등 물리적 성질이 개선되어 작물생육이 촉진된다.⑤ 작물생육이 촉진되면 근계가 발달하고 지상부의 생장량(生長量)이 증가하고 이에 따라 토양에 환원되는 유기물함량도 증가될 것이므로 토양 유기물함량이 증대된다.⑥ 유기물을 시용하면 이에 함유된 각종 와 미량요소인 Fe, Cu, Zn, Mn, B, Mo 등도 공급되어 특히 산성화된 개간지토양에서 고정되기 쉬운 불용성인산을 활성 등 중금속이온과 결합(협상착염, chelate)하여 인산의 유효도를 증대시키는 효과가 있다.(3) 석회 물질의 시용① 개간지의 기경지숙전의 화학적 성질은 매우 달라서 보통 개간지의 토양반응(pH)은 산성화되어 그 값이 낮고, 치환성 Ca, Mg의 함량이 낮아 염기포화도도 기경지의 1/3 정도이고 대부분의 교질물이 미포화교질임이 알려져 있다. 따라서 신개간지의 화학적 성질을 개량하기 위해서는 Ca, Mg 함량이 많은 농용석회나 용성인비를 시용하여야 한다.② 용성인비는 본래 인산질 비료이기 때문에 인산성분을 공급할 목적으로 그 시용량이 정해져야 한다. 그러나 인산공급목적으로 시용되는 용성인비의 양이 10a당 50kg 이상일 경우에는 농용석회 시용량을 용성인비에서 공급되는 Ca나 Mg함량만큼 감소시킬 수가 있다. 그 까닭은 용성인비 중에는 농용석회석분말과 거의 대등한 Ca 및 Mg가 부성분으로 함유되어 있으며 산도 교정능력도 거의 같기 때문이다.③ 농용석회의 적정 시용량은 토양의 성질에 따라 각기 다르므로 개간지에 따라서 작토의 토양시료에 대한 토양검정을 실시하고 그 결과에 의해서 소정의 적정산도(pH 6.5 정도)를 유지할 수 있는 양으로 산정하여야 한다.④ 개간지에 따라 pH가 각각 다르므로 작토의 토양시료에 대한 석회소요량을 검정하여 적정석회소요량을 산정하여 시용하여야 하며 용성인비를 사용하는 경우에는 농용석회 적정소요량에서 용성인비 시용량 중의 석회함량을 감하여야 한다.(4) 인산질 비료의 다량 시용① 개간지 토양은 Ca, Mg 등의 염기 함량은 물론 인산의 함량이 매우 낮아 유효인산함량이 기경지 작토중의 함량의 1/10정도로 알려져 있다. 즉 개간지 토양은 일반적으로 산성화되어 있어서 Al-P, Fe-P의 형태로 고정되어 유효태인산함량이 매우 낮다. 이 때문에 개간지토양에서는 인산의 부족이 거의 모든 작물의 정상생육에 제한인자가 되고 있다.② 인산질 비료를 작토에 시용하면 이의 흡착이 적음은 물론 흡착된다 하여도 유효태인산이 토양교질물 표면에서 고정되고 작물이 흡수 이용하기 어려운 형태로 만드는 능력 즉, 토양의 인산흡수계수가 개간지토양에서는 일반적으로 더 크다. 따라서 인산질 비료의 다량시용이 개간지토양에서는 더욱 요구된다.③ 일반적으로 인산흡수계수의 5%에 해당하는 인산성분량이 작토의 유효인산함량이며 작토중의 유효인산함량이 인산흡수계수의 5%에 미달일 경우에는 용성인비.중과석 등 유효인산을 시용하여야 한다.④ 개간지 토양에 있어서는 인산흡수계수가 큰 반면 유효인산함량이 적기 때문에 인산질비료 시용량은 크게 증가한다.(5) 토양보전과 종합 대책① 개간지는 대부분 경사지나 기복지에 위치하므로 평탄기경지와 비교해 볼 때 비옥도에서 숙전화 이후에도 세심한 토양관리에 유의할 점이 많다. 그 중에서도 토양침식을 방지하여 적절하게 토양을 보전할 것인가 하는 문제는 매우 중요한 개간지 토양관리 사항이다.② 경사 개간지토양에서는 토양유실을 방지하기 위하여 재배법으로서 유거수 조절을 위한 경작법이 도입되어야 한다. 경사도 5°이하의 개간지에서는 등고선재배법, 경사도 5°∼15°경사 개간지에서는 초생대 설치 및 대상재배법, 15°이상의 경사개간지에서는 단구(段丘, terrace)설치재배법 등 경사도에 따라서 적절히 도입해야 한다.③ 연간 나지기간을 단축하기 위하여 피복도가 큰 내식성(耐蝕性)작물을 도입하여 윤작, 간작, 교호작 등의 합리적인 작부체계를 수립해야 한다.④ 숙전화 기간은 물론 숙전 후에도 계속적으로 강우나 강설 후에 유거수량과 유거수 속도를 줄이고, 빗방울의 지표타격작용으로부터의 입단파괴 침식과 비옥도 침식을 방지하기 위해 야생풀 등으로 피복하는 부초법을 적용한다.(6) 작물에 일어나기 쉬운 원소결핍(1) 개간지 토양의 경우 지력부족이나 토양성분의 부족으로 인해 작물에서 원소결핍이 발생하는 경우가 있다. 따라서 작물재배 전에 아래 표와 같이 각각의 재배작물별로 발생하기 쉬운 원소결핍을 검토하여 적절한 양분관리를 실시해야 한다.",Reclamation and Agricultural Development Plan,"1. General Provisions To increase income through rational management by introducing crops into agricultural management in the designated area, it is essential to select crops suitable for the local location conditions to ensure productivity and profitability. 1.2 Scope of Application. Not applicable. 1.3 Reference. Ministry of Agriculture and Forestry, 2006, Revised Design Criteria for Agricultural Production Infrastructure Improvement Project. 1.4 Definitions. None. 1. Definition of 1.5 Symbols. No content 2. Investigation and Planning 2.1 Crops 2. 1.1 Considerations for Crop Selection

For agricultural suitability, crops should be well-adapted to their natural growing environment and possess favorable management and economic conditions. Therefore, when selecting crops, first choose varieties suitable for the natural environment, such as weather and soil, and then select the most profitable ones. However, even within the same crop, varieties can differ in environmental adaptability and quality, leading to varying profitability. Thus, in newly reclaimed land, it is essential to thoroughly investigate the natural growing environment, including weather and soil, scientifically. Weather conditions may fluctuate annually, but they can be relatively easily referenced using multi-year experience and data from nearby weather stations, related agencies, the Rural Development Administration, provincial agricultural technology institutes, and county agricultural technology centers. However, soil conditions vary significantly by region. In particular, in newly reclaimed land where crops have never been grown before, it is impossible to adequately assess soil characteristics based on experience or visual inspection; therefore, analysis should be entrusted to relevant agencies for physicochemical analysis. Such soil surveys are also important as basic data for improving newly reclaimed land. If analysis is difficult, investigate examples of similar areas of previously reclaimed land for reference. Furthermore, favorable management and economic conditions are necessary for high profitability, so thorough research and consideration should be given to various factors such as cultivation purpose (utilization), land use, labor availability, and economic location conditions (marketability) when selecting crops. 2. 1.2 Crop rotation is a method of cultivating several crops in a specific sequence and in rotation on a fixed piece of land. Crop rotation systems include a narrow definition, which involves the combination of preceding and succeeding crops, as well as spatial combinations such as intercropping and mixed cropping. A broader definition encompasses not only the combination of crops but also resource management, input of materials, and cultivation techniques necessary for crop production. When cultivating crops, a plan must be established regarding which crops to plant and in what order on a field. Crop selection should be considered in light of the crop rotation plan, but this is not immutable and changes constantly depending on fluctuations in demand, changes in management type and scale, and changes in soil fertility. In particular, in newly reclaimed land, a crop rotation system that helps improve soil fertility should be established sequentially, taking into account soil fertility and the crops that can be cultivated until the soil is improved. 3. Materials. Not applicable 4. Design The success of upland farming hinges on the fertility of the soil. In Korea, upland soils are generally less fertile than paddy soils, and the foundation for agricultural production is relatively weak. This condition applies to cultivated upland fields as well, and newly reclaimed upland fields are typically acidic. They also tend to be low in humus and clay, have poor soil structure, and are deficient in fertilizer components, including phosphorus, resulting in generally low fertility. Therefore, the primary goal of farming should be to improve the physical and chemical properties of the soil to enhance its fertility (soil productivity). 4. 1.1 Characteristics of Newly Cultivated Land To cultivate newly cultivated land, improvements to physical properties, correction of soil acidity, application of organic fertilizers, and other chemical property improvements must be implemented in conjunction with erosion control measures. (1) Physical Properties of Newly Cultivated Land ① Newly cultivated land is predominantly located on hills or slopes, resulting in a sloped terrain. Consequently, soil erosion is significant, and the soil profile is characterized by a thin topsoil, low porosity, a high solids ratio, and a high bulk density of the topsoil. ② Newly cultivated land has a higher liquid pore volume compared to improved land, but a very low air pore volume and a very small total pore volume compared to mature cultivated land (improved land), which is due to the lack of large pores. Furthermore, newly cultivated land lacks well-developed soil structure and, due to its sloping terrain, has limited opportunities for rainwater to infiltrate the ground, leading to erosion. Additionally, the soil has low water retention capacity, making it prone to drought. ③ Soil texture is often sandy, and in the case of organic soils, the clay content is often excessive. ④ In addition, newly cultivated land is hard, making plowing difficult, and the effective root zone depth (thickness of topsoil) is shallow, which generally hinders the normal growth of crops. (2) Chemical Properties of Newly Cultivated Land ① Newly cultivated land is already acidic compared to mature cultivated land on improved land, or is susceptible to acidification due to its location on slopes or undulating terrain. Therefore, its chemical properties also hinder the normal growth of crops. ② The pH of the topsoil is mostly... It has an acidification of 5.3 or below, and the content of reactive phosphate is... With phosphate absorption coefficients of 600-2,000 (mg/100g) being very high due to very low levels below 4.2 ppm.③ Furthermore, the organic matter content of reclaimed land is... The soil is characterized by very low content, typically below 1.0%, of available nutrients and severe deficiency of trace elements. The levels of exchangeable bases, particularly Ca, Mg, K₂O, and Na, are extremely low compared to virgin land, resulting in a base saturation of only around 25% and a correspondingly low buffering capacity. ④ This is primarily due to the fact that the parent material of Korean soils originates from acidic rocks such as granite and granite gneiss, and that over a long period, leaching of bases has occurred from the surface soil due to rainfall and other factors. Furthermore, the low organic matter content is attributed to significant soil erosion on slopes and undulating terrain, leading to the loss of these organic materials along with runoff water. (1) Cultivated land is mainly used as farmland, and often suffers from extremely poor or immature humus, especially in mountainous areas. It also contains relatively low levels of trace elements such as phosphorus, magnesium, manganese, and boron, and is generally acidic with steep slopes and severe soil erosion. In strongly acidic soils, the activity of beneficial microorganisms is inhibited, hindering the decomposition of organic matter. The soil's ability to absorb ammonia is weak, leading to nutrient loss through leaching even when fertilizer is applied. Phosphorus becomes insoluble and ineffective when applied, and harmful ions such as aluminum are leached, all of which are detrimental to crop growth. 4. 1.2 Methods for Improving Land Productivity To improve the land productivity of newly reclaimed land, measures should be established to increase soil depth, apply organic matter, apply lime and phosphate fertilizers, and conserve the soil. (1) Increasing Soil Depth ① Reclaimed soils are very hard because the topsoil has been lost, resulting in a thin layer of arable soil, and most of it is residual soil. Therefore, deep plowing (심경) is necessary to increase the arable soil layer, and mechanical power should be used to focus on deep plowing first. ② Reclaimed soils are hard, making tillage difficult, but gradual improvement in hardness will be achieved by reducing the moisture content through the application of agricultural lime and a large amount of organic matter. At the same time, the water retention and permeability of the arable soil will be improved, and the distribution range of crop roots will be expanded, which will promote weathering of the deep soil layer, gradually increasing the effective soil depth (arable layer). ③ To increase the effective soil depth, deep plowing should be performed, and at this time, the amount of organic matter, agricultural lime, and other fertilizers should be increased, which will also greatly contribute to increasing the effective soil depth. (2) Applying Large Amounts of Organic Matter ① Reclaimed soils have a very low organic matter content because of accelerated erosion, leaving little time for humus accumulation. In fact, the organic matter content of reclaimed soils is around 1%, which is about half that of virgin land, so a large amount of organic matter is needed. ② As a provisional method to improve the organic matter content of the arable layer, the amount of organic matter to be applied should be calculated to maintain the organic matter content in the arable layer at a target level (2-3%). ③ Although well-rotted compost has a decomposition rate of about 30%, a large amount of organic matter is required for reclaimed land. In addition to preventing accelerated erosion, water retention is also a major problem, so it is also necessary to apply raw manure (manure) such as straw as mulch (敷草) to conserve effective moisture, prevent soil erosion, and then incorporate it into the soil to increase organic matter. ④ When organic matter is applied to the arable layer in this way, soil microorganisms mineralize it, and the soil particles are agglomerated by immature humus, mycelia, polyuronides, etc., thus increasing the proportion of macropores and total pore volume, improving physical properties such as water retention and permeability, and promoting crop growth. ⑤ As crop growth is promoted, the root system develops, the aboveground biomass increases, and the amount of organic matter returned to the soil also increases, thus increasing the soil organic matter content. ⑥ When organic matter is applied, various trace elements such as Fe, Cu, Zn, Mn, B, and Mo are also supplied. Especially in acidified reclaimed soils, it can increase the effectiveness of phosphorus that is easily fixed by chelating (협상착염) with active metal ions. (3) Applying Lime Materials ① The chemical properties of reclaimed land vary greatly. Generally, the soil pH of reclaimed land is acidified, with a low value, and the content of exchangeable Ca and Mg is low, resulting in a base saturation ratio of about 1/3 of that of virgin land, and most of the colloidal particles are incompletely saturated. Therefore, to improve the chemical properties of newly reclaimed land, agricultural lime or phosphate fertilizer with high Ca and Mg content should be applied. ② Phosphate fertilizer is originally applied to supply phosphorus, so the application amount should be determined accordingly. However, if the amount of phosphate fertilizer applied for phosphorus supply exceeds 50 kg per 10a, the application amount of agricultural lime can be reduced by the amount of Ca or Mg supplied by the phosphate fertilizer. This is because phosphate fertilizer contains almost equal amounts of Ca and Mg as powdered agricultural limestone and has almost the same acidity correction ability. ③ The appropriate application amount of agricultural lime varies depending on the soil properties, so soil samples from the arable layer should be tested for soil analysis for each reclaimed area, and the appropriate pH should be determined based on the results. 1. **Liming Requirements:** The amount of lime to be applied should be determined to maintain a pH level of around 6.5. ④ Since the pH varies depending on the reclaimed land, test the lime requirement of the topsoil samples and determine the appropriate lime application rate. When using superphosphate fertilizer, deduct the lime content of the superphosphate application amount from the appropriate lime application rate.

2. **Phosphorus Fertilizer Application:** ① Reclaimed soils are characterized by very low levels of basic cations such as Ca and Mg, as well as a very low available phosphorus content, which is known to be about 1/10 of the amount in cultivated topsoil. In other words, reclaimed soils are generally acidic and phosphorus is fixed in the form of Al-P and Fe-P, resulting in very low levels of available phosphate. Therefore, phosphorus deficiency is a limiting factor for the normal growth of almost all crops in reclaimed soils. ② When phosphorus fertilizer is applied to the topsoil, its adsorption is not only low, but even if it is adsorbed, the available phosphate is fixed on the surface of soil aggregates and converted into a form that is difficult for plants to absorb and utilize. This ability, i.e., the soil's phosphorus absorption coefficient, is generally higher in reclaimed soils. Therefore, a higher application rate of phosphorus fertilizer is required in reclaimed soils. ③ Generally, the amount of phosphorus corresponding to 5% of the phosphorus absorption coefficient is the available phosphorus content in the topsoil, and if the available phosphorus content in the topsoil is less than 5% of the phosphorus absorption coefficient, effective phosphorus fertilizers such as soluble phosphate and diammonium phosphate should be applied. ④ In reclaimed soils, the phosphorus absorption coefficient is high while the available phosphorus content is low, so the phosphorus fertilizer application rate must be significantly increased.

3. **Soil Conservation and Comprehensive Measures:** ① Reclaimed land is mostly located on slopes or undulating terrain, so compared to flat cultivated land, there are many points to pay attention to in soil management even after soil ripening. Among these, the issue of preventing soil erosion and appropriately conserving the soil is a very important soil management task for reclaimed land. ② In sloped reclaimed soils, cultivation methods for controlling runoff should be introduced to prevent soil loss. For reclaimed land with a slope of 5° or less, contour farming should be adopted; for reclaimed land with a slope of 5° to 15°, sod installation and ridging should be adopted; and for reclaimed land with a slope of 15° or more, terrace construction should be adopted, depending on the slope. ③ To shorten the annual bare period, introduce erosion-resistant crops with high ground cover and establish a reasonable cropping system such as rotation, intercropping, and mixed cropping. ④ Not only the soil ripening period but also continuously after ripening, reduce runoff volume and runoff velocity after rainfall or snowfall, and apply mulching with wild grasses to prevent erosion caused by the impact of raindrops on the ground surface and the erosion of fertility.

4. **Nutrient Deficiencies in Crops:** ① In reclaimed soils, nutrient deficiencies in crops can occur due to poor soil fertility or lack of soil components. Therefore, before planting crops, examine the nutrient deficiencies likely to occur for each crop to be cultivated, as shown in the table below, and conduct appropriate nutrient management."
