codeType,code,name,contents,name_en,contents_en
KDS,676005,개간 일반사항,"1. 일반사항1.1 목적개간의 목적은 농업에 이용하여 생산을 증대시킬 목적으로 황무지, 소택지(沼澤地), 폐염전, 임야 등의 미간지를 개발하여 논, 밭, 과수원 등의 농지로 조성하고 그 부대시설을 설치 또는 변경하는 것을 말한다. 일반적으로 개간의 내용은 개간작업, 부대시설로 대별된다. 개간작업은 미간지를 농지의 형태로 정비하기 위한 작업으로서 농지로 만드는 것을 말한다. 부대시설은 당해 개간지의 영농을 위하여 필요한 시설로서 관리사, 창고, 퇴비사 및 고정온실 등을 말한다.은 개간사업 시행 체계도를 보여주고 있다. 개간사업 시행 체계도1.1.1 개간의 기본방향개간은 종합개발의 일환으로 추진되어야 하며 단순한 물리적.공간적인 농지의 확장이라는 개념을 떠나 산업입지로서 지속가능한 농업을 위한 시설구비에 역점을 두어야 한다.개간은 토지자원의 농업용지로의 규모 확대 가능성은 크지만 개발조건으로 볼 때 대부분의 대상지가 경사지라는 입지조건으로 인해 어려운 경우가 많다. 장차 농지로 조성할 수 있는 개간적지에 조림을 한다거나, 목야지 또는 과수원으로 밖에 이용할 수 없는 토지를 밭으로 개간하는 등과 같은 잘못된 토지이용과 특히 경사지에 대해서 토양침식도 고려하지 않고 개간하는 등 잘못된 개발은 조성된 농지자체에서 얻는 수익보다 간접적인 피해와 국토의 황폐를 초래하게 된다. 따라서 올바른 개발이용을 위해서는 자연상태에 있는 토지자체를 면밀히 평가 분석한 토지능력구분에 근거를 두고 여기에 기술적.사회적인 여건에 적합한 개발이 이루어져야 한다.개간을 하는 데 있어서 주요 기본방향을 보면 다음과 같다. (1) 개간은 종합개발의 일환으로 추진되어야 한다. 이제까지의 개간은 주로 논이나 밭을 주 대상으로 하는 산발적인 농지조성이었다. 그러나 금후의 과제는 기경지를 포함한 그 지역전체의 토지이용도를 최대한으로 높인다는 관점에서 종합적이고 입체적인 구조 위에 새로운 영농체제를 유치할 수 있는 방향으로 개발하여야 한다. (2) 개간사업의 내용은 단순한 물리적.공간적인 농지의 확장이라는 개념을 떠나 산업입지로서 새로운 농업전개를 위한 시설구비에 역점을 두어야 한다. 산업도로의 개설 또는 정비를 비롯하여 관개 및 배수시설과 방재시설 등 기간시설의 건설이 타 사업과의 유기적인 관계 하에 이루어져야 한다. 1.1.2 개간의 특수성개간은 대개 입지조건이 불리한 곳이 대상이 되므로 개발에 과다한 노력이 투입되며, 숙전, 숙답화 까지 소요되는 영농노력의 과중과 용수조건의 제약 등이 따르게 된다. 또한 토지소유자와 개간자가 서로 다른 경우 개간지의 소유권과 분배문제를 비롯하여 투하자본과 수익성에 대한 보장 등 많은 문제점을 내포하고 있다.우리나라의 개간대상지가 주로 경사지 임야이며 기존 농지에 비하여 비교적 높은 곳에 위치하기 때문에 노동의 부담과 토지생산력의 저하는 피할 수 없다. 그러나 국지기후 및 토성의 다양성을 이용하여 새롭고 적합한 품종을 시험개발하거나 또는 이에 적응하는 특수작물의 재배지로서의 이용은 개간지에 기대되는 농업개발의 새로운 분야라 할 수 있다. 개간은 농업생산의 기반조성을 목적으로 농지를 조성하는 공사이기 때문에 일반적인 토목공사 등과는 성격을 달리하는 점이 많으며 다음과 같은 특수조건을 포함하고 있다.(1) 입지조건이 나쁜 장소이다. (2) 면공사이기 때문에 설계의 기초가 되는 각종 조사항목을 개간예정지 전 구역에 걸쳐서 상세히 조사한다는 것은 어려우므로 일반적으로 표준조사에 의존하게 된다. (3) 설계조건을 획일적으로 설정하기 곤란하여 현지의 상황에 따라 변경조치를 취하는 경우가 많다.(4) 토지 및 노동의 생산성이 높은 포장을 조성하는 것이 최종 목적이므로 완성된 후에 형상, 치수 등의 물리적 요소만으로 평가하기 어렵다. (5) 동일면에 대해서 몇 종류의 공사를 반복 시공할 뿐 아니라 취급하는 흙의 함량에 따라 시공이 제약되므로 기상조건, 특히 강우, 서리, 눈의 영향을 심하게 받는 경우가 많다.(6) 여러 가지 공종이 서로 관련되어 있어서 공정관리가 어려우며, 공사기간의 결정은 강우 등의 기상조건 외에 조성지에서 영농할 작부체계와 파종 등의 재배관리와도 관련이 있기 때문에 이를 고려하여야 한다. (7) 지형, 식생 등의 형태를 광범위하게 바꾸게 되므로 재해방지에 특별히 주의해야 한다. 1.1.3 개간사업의 효과개간사업의 투자효과는 국토의 효율적 이용에 있다.1.2 적용범위이 기준은 농어촌정비법(2015년 1월 6일 법률 제12963호) 제2조 제5호의 규정에 근거하여 시행하는 농업생산기반정비사업으로 이루어지는 개간사업과 관련된 조사, 계획, 설계, 시공 및 관리에 관한 일반적인 사항을 기술한 것으로 개간 사업과 관련되는 기술과 방법의 체계화 및 기술 수준의 향상에 기여함을 목적으로 한다.이 기준은 농어촌정비법에 근거한 농업생산기반정비사업으로 이루어지는 개간의 조사, 계획, 설계 및 관리에 대하여 적용하며, 이 기준에서 사용된 법규, 기준, 편람, 표준시방서 등의 규정이나 관련 근거가 개정된 경우에는 개정된 규정 및 관련 근거를 적용한다.여기에 관련된 주요 자료는 농어촌정비법(2015년 1월 6일 법률 제12963호), 개간업무지침(2004. 12. 24. 농림부 훈령 제1184호), 개간업무편람(2005. 6.), 산림기본법(2015. 1. 20. 법률 제13025호), 개간사업 추진에 관한 규정 (2013. 11. 15. 농림축산식품부 고시 제2013-294호) 등이다.1.3 참고 기준. 농림부, 2006, 농업생산기반정비사업계획 설계기준 개간 편1.4 용어의 정의. 내용 없음1.5 기호의 정의. 내용 없음2. 조사 및 계획. 내용 없음3. 재료. 내용 없음4. 설계. 내용 없음",General Remarks,"1. General Provisions 1.1 The purpose of the targeted land reclamation is to develop undeveloped land, wetlands (沼澤地), salt evaporation fields, forests, and other marginal lands for agricultural use to increase production, and to create farmland such as rice paddies, fields, and orchards, and to install or modify associated facilities. Generally, land reclamation consists of reclamation work and associated facilities. Reclamation work refers to the work of converting marginal land into agricultural land. Associated facilities refer to facilities necessary for farming in the reclaimed area, such as offices, storage sheds, compost sheds, and greenhouses. This illustrates the implementation system for land reclamation projects. Land reclamation project implementation system diagram. 1. 1.1 Land Reclamation: Basic Directions

Land reclamation projects should be pursued as part of comprehensive development, moving beyond the concept of simple physical and spatial expansion of farmland. Instead, they should prioritize the provision of facilities for sustainable agriculture as an industrial location. While land resources offer significant potential for expanding agricultural land, reclamation is often difficult due to the challenging topographical conditions – most target areas are slopes. Incorrect land use practices, such as afforestation of land suitable for agricultural development, reclamation of pasture or orchards into arable land, and particularly reclamation on slopes without considering soil erosion, can lead to indirect damage and national land degradation that outweigh the profits generated from the newly created farmland. Therefore, appropriate development should be based on a thorough evaluation and analysis of the land’s natural state, considering its land capability classification, and incorporating development that is suitable for the technical and social conditions.

The main principles for land reclamation are as follows:

(1) Land reclamation should be pursued as part of comprehensive development. Previously, reclamation mainly involved sporadic farmland creation focusing on paddy fields and arable land. However, the future task is to develop in a direction that attracts new agricultural management systems, based on a comprehensive and three-dimensional structure that maximizes the land use efficiency of the entire area, including existing cultivated land.

(2) The scope of land reclamation projects should move beyond the concept of simple physical and spatial expansion of farmland and focus on the provision of facilities for the advancement of new agricultural practices as an industrial location. This should include the construction of essential infrastructure such as industrial road construction or improvement, irrigation and drainage facilities, and fire prevention facilities, all in an organic relationship with other projects. 1. ""1.2 Reclamation’s Peculiarity Reclamation projects typically target locations with unfavorable conditions, requiring extensive development efforts and substantial agricultural labor, including land preparation and terracing, along with limitations on water resources. Furthermore, when landowners and reclamation operators are different, numerous issues arise, such as land ownership and distribution disputes, and the need to guarantee invested capital and profitability. In Korea, reclamation sites are primarily steep, forested areas, which are relatively higher in elevation compared to existing farmland, inevitably leading to increased labor burdens and reduced land productivity. However, utilizing local climates and soil characteristics to develop or test new, suitable varieties or to utilize them as cultivation sites for specialized crops can be considered a new area of agricultural development expected from reclamation projects. Reclamation is a construction project aimed at establishing the foundation for agricultural production, and therefore differs significantly from general civil engineering projects in many aspects, including the following special conditions: (1) The location has poor site conditions. (2) As it is a surface construction project, it is difficult to conduct detailed surveys of all items that form the basis of the design across the entire reclamation area; therefore, standard surveys are generally relied upon. (3) It is difficult to set uniform design conditions, and changes are often made based on local circumstances. (4) The ultimate goal is to create a field with high land and labor productivity, making it difficult to evaluate it solely based on physical elements such as shape and dimensions after completion. (5) Several types of construction are repeated on the same surface, and construction is restricted depending on the soil content being handled, making it highly susceptible to weather conditions, especially rainfall, frost, and snow. (6) Various construction processes are interrelated, making project management difficult, and the determination of construction period is related not only to weather conditions such as rainfall but also to the cropping system and sowing management of the farm to be cultivated on the site, so these factors must be considered. (7) The terrain and vegetation are significantly altered, so special attention must be paid to disaster prevention."" 1. 1.3 Effects of Land Reclamation Project The investment effect of land reclamation project lies in the efficient utilization of the national land. 1.2 Scope of This Standard This standard describes general matters related to surveys, planning, design, construction, and management concerning land reclamation projects carried out as part of agricultural production infrastructure improvement projects implemented based on Article 2, Paragraph 5, of the Rural Development Act (Law No. 12963, January 6, 2015). It aims to contribute to the systematization of technologies and methods related to land reclamation projects and to improve the level of technical expertise. This standard applies to surveys, planning, design, and management of land reclamation projects carried out as part of agricultural production infrastructure improvement projects based on the Rural Development Act. If the regulations, standards, manuals, standard specifications, or related basis used in this standard are revised, the revised regulations and related basis shall be applied. Relevant key materials include the Rural Development Act (Law No. 12963, January 6, 2015), Land Reclamation Work Guidelines (Notification No. 1184 of the Ministry of Agriculture and Forestry, December 24, 2004), Land Reclamation Work Manual (June 2005), Forest Act (Law No. 13025, January 20, 2015), and Regulations on the Promotion of Land Reclamation Projects (Notification No. 2013-294 of the Ministry of Agriculture, Food and Rural Affairs, November 15, 2013), among others. 1.3 Reference Standard. Ministry of Agriculture, Food and Rural Affairs, 2006, Revised Design Criteria for Agricultural Production Infrastructure Improvement Project Plans. 1.4 Definition of Terms. No content. 1. Definition of 1.5 Symbol. No content 2. Investigation and Planning. No content 3. Materials. No content 4. Design. No content"
