codeType,code,name,contents,name_en,contents_en
KDS,316010,지열원열펌프설비,"1. 일반사항1.1 목적(1) 이 기준은 지열 에너지를 사용하는 지열열펌프 설비에 대하여 사용목적에 적합하도록 설계하는 기준의 제시를 목적으로 한다.  1.2 적용범위(1) 이 기준은 공간의 냉방, 난방, 급탕 또는 프로세스 가열을 위해 지열을 활용하는 열펌프 시스템 전반의 설계에 적용한다. 1.3 용어 정의(1) 인증서 : 지열원열펌프에 대한 인증서(2) 사업용량 : 지열시스템의 냉/난방 설치용량중 큰 값 + 급탕용량(3) 설치용량 : 인증서에 표기된 열펌프의 냉/난방 정미능력(4) 설계용량 : 시스템 설계를 위해 열원측/부하측에 적용된 EWT 기준으로 시험성적서 또는 성능표에 분석된 열펌프 정미능력 (5) 열펌프 COP(Coefficient of Performance) : 열펌프의 성능계수(6) 시스템 COP(Coefficient of Performance) : 지중 순환펌프의 소요동력을 포함한 지열시스템 성능계수1.4 참조 기준1.4.1 관련 법규● 저탄소 녹생성장 기본법, 동 시행령● 신에너지 및 재생에너지 개발ㆍ이용ㆍ보급 촉진법, 동 시행령, 동 시행규칙● 녹색건축물 조성 지원법, 동 시행령, 동 시행규칙● 신.재생에너지설비의 지원.설치.관리에 관한 기준● 온실가스 배출권의 할당 및 거래에 관한 법률 시행령● 신․재생에너지 공급의무화제도 및 연료 혼합의무화제도 관리․ 운영지침 ● 신재생에너지설비 시공기준 ● 일반 건축물 신재생 에너지 설비시스템 표준설계 가이드라인, 한국에너지공단, 2010● KIAEBS S-4 지열냉난방설비 설계 기준 2015-한국건축친환경설비학회● KCS 31 60 10 지열원열펌프설비공사 2. 조사 및 계획(1) 내용 없음.3. 자재 (1) KCS 31 60 10에 따른다.4. 설계 4.1 지열원열펌프 설비의 도입절차(1) 지열 이용시스템의 사용용도 검토(냉방, 난방, 급탕 등)(2) 대상 건축물과 대지의 특성 확인(3) 법적 규제 확인(4) 지질의 상태 확인(열전도 테스트)(5) 주변의 영향 확인 / 개방형의 경우 지하수영향조사 및 수질, 지하수 수량 확인 (6) 경제성 등을 고려하여 시스템의 종류 및 용량을 적절히 선정(7) 그 밖의 필요사항 확인4.2 지열원열펌프 설비의 설계 프로세스4.3 지열원열펌프 설비의 설계(1) 대상건물의 부하계산① 부하계산 전문프로그램을 이용하여 건축물의 용도 및 건축재, 마감재 등을 반영하여 계산한다.(2) 대상건물의 현장파악① 천공 가능한 위치 및 면적을 산정한다.② 기계실, 부하 존, 타 공조시스템과의 연계상황을 파악한다.③ 수전 용량, 전기 사양을 확인한다.④ 옥외 시공부위에 대한 토목관로, 기반시설 인입에 대한 간섭여부를 파악한다.(3) 지중열교환기 및 시스템 일반형식 결정① 대상 건축물의 부하패턴, 부하용량, 천공 부지의 상황을 고려하여 지중 시스템을 밀폐형 또는 개방형으로 할지 설계 방안을 선정한다.② 냉․난방 부하만 처리할 것인지, 급탕부하도 처리할 것인지, 건물 높이가 낮아 물-냉매 방식이 효과적인지 등을 고려하여 부하측 시스템을 물-냉매 방식으로 할지 물-물 방식할지 결정한다.③ 선정시 KS 인증된 고효율의 지열원열펌프를 적용한 시스템을 우선 고려한다.④ 전력피크 및 사용자의 운전비 절감을 위해 수축열 지열시스템 및 냉각탑, 보일러 등과 연동된 지열하이브리드 시스템을 비교․검토하여 최적설계안을 선정한다.(4) 표준 규격의 지열시스템 기본설계시스템 설계 시 현장의 지중 열전도 테스트 결과를 반영하여 기본설계를 한다.(5) 시험천공 및 지열 지중열전도 테스트① 시험천공 및 지열 열전도 테스트는 기본설계의 타당성을 검증하고 최종적인 지열시스템의 사양을 결정하기 위함이다.② 시험 홀에 정해진 열부하를 주입하면서 열교환기 내부를 순환하여 지중으로 발산하는 유체 온도변화의 경사도 및 주입된 열량을 기준으로 하여 측정하게 된다.③ 작도법(순환시 및 회복시) 및 히스토리 매칭법의 두 가지 이상의 분석방법을 이용하여 유효 열전도율 λ[W/(m.K)]를 결정하고 시뮬레이션 프로그램을 이용하여 측정 단위 길이당 열교환량 ql [W/m]을 결정한다. (열전도도 및 지중초기온도 측정)④ 시뮬레이션 프로그램은 국제적으로 통용, 인정되는 전문 설계 프로그램(GLD, GLHEPro, GchpCalc, EED, FEFLOW 등)을 이용한다.⑤ 시뮬레이션에서 20년 이상의 유입온도(EWT)(entering water temperature) 변화를 검토하여, 설계 시 적용한 냉방 유입온도(EWT)와 난방 유입온도(EWT)가 확보되는지 확인해야 한다.(6) 지열 열교환기 규격 확정 및 시공설계① 지열 열교환기 설계프로그램을 사용하여 시험시추 암반의 성상 및 열전도 테스트 결과를 입력하여 계산한다.② 필요데이터는 건물의 연간부하, 현장의 열전도 데이터, 현장의 암반구성 데이터, 히트펌프 규격, 지중 평균온도, 순환수 규격, 지중열교환기 배치 등이다.③ 지열열펌프의 용량은 지중열교환기의 단위길이 당 열교환량 (보통 60 W/m) 산출방법을 이용한다. ⓐ 평일 8시간, 냉방 3개월, 난방 4개월의 일반 업무시설(공조 이용)의 경우는 50 ~ 70 [W/m]ⓑ 상기 이외의 경우는 30 ~ 40 [W/m]을 적용하되 건물의 특성에 맞는 냉‧난방 운전시간 등을 고려하여 반영한다.④ 지중 열교환기의 총길이는 냉난방시 지중열교환기 필요길이의 최대값으로 한다.⑤ 보어 홀 개수는 지중열교환기 필요길이를 지중열교환기 1개당 길이를 나누어 산출한다.여기서     N      : 지중열교환 보어 홀의 개수 [개]            D      : 지중열교환기 1개당 길이 [m/개]            Lc     : 지중열교환기 필요길이 [m]⑥ 지중 열교환기에 사용하는 열매체는 원칙적으로 물로 한다. 다만, 한랭지 등의 동결방지 대책으로서 부동액의 사용을 검토하는 경우는 기기에 대한 영향, 안정성 및 환경성 등을 고려하여 결정한다. 또한 부동액을 주입할 경우 15%농도 이상(동결점 –6℃)확보하도록 한다.(7) 시스템 일반장비 규격 확정① 시스템 용량, 순환 펌프, 팽창탱크, 냉온수 저장탱크, 순환배관을 선정한다.② 상기 지열원열펌프설비의 설계기준은 신.재생에너지 설비의 지원 등에 관한 규정   (산업통상자원부 고시 제2016-249호)신재생에너지 설비의 지원 등에 관한 지침   (센터공고 제 2018-5호)에 준하여 설계적용 한다.③ 녹색기술, 녹색제품을 적용 시 녹색인증제 운영요령에 준하여 설계에 적용한다.",Geothermal heat pump system,"1. General Provisions 1.1 Purpose (1) This standard aims to provide criteria for designing geothermal heat pump systems using geothermal energy to be suitable for their intended use. 1.2 Scope of Application (1) This standard applies to the design of geothermal heat pump systems utilizing geothermal energy for space cooling, heating, domestic hot water, or process heating. 1.3 Definitions (1) Certificate: Certificate for the geothermal heat pump (2) Business Capacity: The larger value of the geothermal system's heating/cooling installation capacity plus the hot water capacity (3) Installation Capacity: The heating/cooling capacity of the heat pump indicated on the certificate (4) Design Capacity: The heat pump capacity analyzed in the test performance report or performance sheet based on the EWT applied to the source side/load side for system design (5) Heat Pump COP (Coefficient of Performance): The performance coefficient of the heat pump (6) System COP (Coefficient of Performance): The performance coefficient of the geothermal system including the required power of the ground circulation pump. 1.4 Reference Standard 1. 4.1 Related Regulations● Low Carbon Green Growth Basic Act, and its Enforcement Ordinance● Act on the Promotion of Development, Utilization and Distribution of New and Renewable Energy, and its Enforcement Ordinance, and its Enforcement Regulations● Act on the Promotion of Green Building Construction, and its Enforcement Ordinance, and its Enforcement Regulations● Standards for Support, Installation and Management of New and Renewable Energy Facilities● Enforcement Ordinance of the Act on Allocation and Trading of Greenhouse Gas Emission Allowances● Management and Operation Guidelines for the Renewable Portfolio Standard and Fuel Blending Mandate● Construction Standards for New Renewable Energy Facilities● Standard Design Guidelines for New Renewable Energy Facility Systems in General Buildings, Korea Energy Agency, 2010● KIAEBS S-4 Geothermal Heating and Cooling Facility Design Standard 2015-Korea Society of Green Building and HVAC● KCS 31 60 10 Geothermal Heat Pump System Construction 2. Investigation and Planning (1) None. 3. Materials (1) Follows KCS 31 60 10. 4. Design 4.1 Introduction Procedure of Geothermal Heat Pump Systems (1) Review of the intended use of the geothermal utilization system (cooling, heating, hot water supply, etc.) (2) Verification of the characteristics of the target building and site (3) Confirmation of legal regulations (4) Verification of geological conditions (thermal conductivity test) (5) Assessment of surrounding impact / In the case of open systems, groundwater impact assessment, water quality, and groundwater quantity verification (6) Select the type and capacity of the system appropriately, considering economic feasibility, etc. (7) Verification of other necessary items. 4.2 Geothermal Heat Pump System Design Process 4.3 Design of Geothermal Heat Pump Systems (1) Load Calculation for the Target Building
① Calculate the load using a dedicated load calculation program, reflecting the building's purpose, construction materials, and finishing materials.
② Site Assessment of the Target Building
① Determine the location and area where boreholes can be drilled.
② Identify the mechanical room, load zones, and the connection status with other HVAC systems.
③ Verify the water capacity and electrical specifications.
④ Determine potential interference with underground conduits and infrastructure connections in the outdoor construction area.
(3) Determination of the General Type of Ground Heat Exchangers and Systems
① Select the design approach, whether to use a closed-loop or open-loop ground system, considering the target building's load pattern, load capacity, and borehole site conditions.
② Determine whether to use a water-refrigerant (water-to-refrigerant) or water-to-water system, considering whether to handle only heating and cooling loads or also domestic hot water loads, and whether a low-building height makes a water-refrigerant system effective.
③ Prioritize the application of systems using high-efficiency geothermal heat pumps certified by KS.
④ To reduce peak electricity demand and operating costs, compare and evaluate geothermal hybrid systems interconnected with condensing heat recovery geothermal systems, cooling towers, and boilers, and select the optimal design.
(4) Basic Design of Standard Geothermal Systems
Design the basic system, reflecting the results of the in-situ ground thermal conductivity tests.
(5) Test Borehole and Geothermal Ground Thermal Conductivity Test
① The test borehole and geothermal thermal conductivity test are performed to verify the feasibility of the basic design and to determine the final specifications of the geothermal system.
② Measurements are taken based on the gradient of the fluid temperature change as it circulates through the heat exchanger and is discharged into the ground, and the amount of heat injected, using a specified thermal load injected into the test borehole.
③ Determine the effective thermal conductivity λ [W/(m.K)] using at least two analysis methods, such as the plotting method (during circulation and recovery) and the history matching method, and determine the heat exchange quantity per unit length of measurement ql [W/m] using a simulation program. (Measurement of thermal conductivity and in-situ ground temperature)
④ Use internationally recognized and accepted professional design programs (GLD, GLHEPro, GchpCalc, EED, FEFLOW, etc.) for simulations.
⑤ Examine 20 years or more of entering water temperature (EWT) changes in the simulation to verify that the entering water temperatures (EWT) for cooling and heating, applied in the design, are secured.
(6) Finalization of Geothermal Heat Exchanger Specifications and Construction Design
① Calculate using a geothermal heat exchanger design program, inputting the characteristics of the bedrock from the test borehole and the results of the thermal conductivity test.
② Required data includes the building's annual load, on-site thermal conductivity data, on-site bedrock composition data, heat pump specifications, average ground temperature, circulating water specifications, and ground heat exchanger layout.
③ The capacity of the geothermal heat pump is calculated using the method of heat exchange quantity per unit length of the ground heat exchanger (typically 60 W/m).
ⓐ For a general office building (with air conditioning) operating 8 hours on weekdays, 3 months for cooling, and 4 months for heating, apply 50 to 70 [W/m].
ⓑ For other cases, apply 30 to 40 [W/m], but consider the building's characteristics and appropriate heating/cooling operating hours.
④ The total length of the ground heat exchanger is the maximum value of the required length of the ground heat exchanger for cooling and heating.
⑤ The number of boreholes is calculated by dividing the required length of the ground heat exchanger by the length of one ground heat exchanger.
Where:
N: Number of geothermal heat exchanger boreholes [ea]
D: Length of one geothermal heat exchanger [m/ea]
Lc: Required length of the ground heat exchanger [m]
⑥ Water is primarily used as the heat transfer fluid in the ground heat exchanger. However, consider the use of antifreeze as a countermeasure against freezing in cold regions, considering its impact on the equipment, stability, and environmental aspects. If antifreeze is injected, ensure a concentration of 15% or more (freezing point –6℃).
(7) Finalization of System General Equipment Specifications
① Select system capacity, circulating pumps, expansion tanks, hot and cold water storage tanks, and circulating piping.
② The design criteria for the geothermal heat pump system shall apply in accordance with the Regulations on Support for Renewable Energy Facilities (Notice No. 2016-249 of the Ministry of Trade, Industry and Energy) and the Guidelines on Support"
